name,datetime,tempmax,tempmin,temp,feelslike,humidity,precip,precipprob,precipcover,preciptype,windspeed,winddir,sealevelpressure,cloudcover,severerisk,sunrise,sunset,description,stations,source
70062,1/23/2026,62.1,56.9,58.4,58.4,92.9,0,0,0,,10.3,32,1020.9,91.8,10,2026-01-23T06:55:37,2026-01-23T17:30:35,Cloudy skies throughout the day.,KMSY,obs
70062,1/22/2026,67.9,57.8,62.4,62.4,91.7,0,0,0,,9.2,346.4,1020.2,83,10,2026-01-22T06:55:58,2026-01-22T17:29:42,Partly cloudy throughout the day.,KMSY,obs
70062,1/21/2026,70.1,48.8,60.5,60.4,68.6,0.012,100,4.17,rain,21.9,125.2,1024.5,94,10,2026-01-21T06:56:18,2026-01-21T17:28:50,Cloudy skies throughout the day with late afternoon rain.,KMSY,obs
70062,1/20/2026,61.1,36,49.2,49.1,65.8,0,0,0,,13.9,84.8,1030.3,81.7,10,2026-01-20T06:56:36,2026-01-20T17:27:57,Partly cloudy throughout the day.,KMSY,obs
70062,1/19/2026,56.9,30.8,43.7,43.4,52.7,0,0,0,,8.1,23.1,1027.7,11.5,10,2026-01-19T06:56:52,2026-01-19T17:27:05,Clear conditions throughout the day.,KMSY,obs
70062,1/18/2026,47.9,35.1,42.3,36.5,39.6,0,0,0,,18.3,318.5,1025.8,17.2,10,2026-01-18T06:57:07,2026-01-18T17:26:13,Clear conditions throughout the day.,KMSY,obs
70062,1/17/2026,56.9,46.1,53.3,51.8,60.2,0,0,0,,18.3,354.4,1021.1,81.4,10,2026-01-17T06:57:20,2026-01-17T17:25:21,Partly cloudy throughout the day.,KMSY,obs
70062,1/16/2026,69.2,35.1,53.6,53.2,65.3,0,0,0,,17.2,164.8,1017.6,28.7,10,2026-01-16T06:57:32,2026-01-16T17:24:29,Becoming cloudy in the afternoon.,KMSY,obs
70062,1/15/2026,54.1,38.9,47.7,45.2,48.4,0,0,0,,15,331.3,1020,33.4,10,2026-01-15T06:57:42,2026-01-15T17:23:38,Partly cloudy throughout the day.,KMSY,obs
70062,1/14/2026,65.9,49.9,56.2,55.7,64.2,0.012,100,4.17,rain,16.1,280.5,1015.3,77.2,10,2026-01-14T06:57:50,2026-01-14T17:22:47,Partly cloudy throughout the day with early morning rain.,KMSY,obs
70062,1/13/2026,58.9,36,49,48.7,53.6,0,0,0,,9.2,216.5,1024.1,52.8,10,2026-01-13T06:57:56,2026-01-13T17:21:56,Partly cloudy throughout the day.,KMSY,obs
70062,1/12/2026,53.1,42.2,47.6,44.5,44.6,0,0,0,,16.1,33.6,1030.3,63.8,10,2026-01-12T06:58:01,2026-01-12T17:21:06,Partly cloudy throughout the day.,KMSY,obs
70062,1/11/2026,61.1,48.8,55,54.6,48.2,0,0,0,,17.2,356,1029.3,77,10,2026-01-11T06:58:04,2026-01-11T17:20:16,Partly cloudy throughout the day.,KMSY,obs
70062,1/10/2026,74,58.9,69.4,69.4,86.5,0.961,100,12.5,rain,23,279.9,1019.3,92.5,30,2026-01-10T06:58:06,2026-01-10T17:19:26,Cloudy skies throughout the day with rain in the morning and afternoon.,KMSY,obs
70062,1/9/2026,80.1,71.1,75.1,75.4,87.1,0,0,0,,21.9,160.7,1015.9,89.8,30,2026-01-09T06:58:06,2026-01-09T17:18:37,Partly cloudy throughout the day.,KMSY,obs
70062,1/8/2026,78.2,64.1,70.8,70.8,86,0,0,0,,20.8,151.1,1015.3,86.3,10,2026-01-08T06:58:04,2026-01-08T17:17:49,Partly cloudy throughout the day.,KMSY,obs
70062,1/7/2026,80.1,63.1,69.2,69.3,86.3,0,0,0,,12.8,229.3,1016.2,74.1,10,2026-01-07T06:58:00,2026-01-07T17:17:01,Partly cloudy throughout the day.,KMSY,obs
70062,1/6/2026,81.1,61.1,69.3,69.4,80.8,0,0,0,,16.1,214.7,1016,55.4,10,2026-01-06T06:57:55,2026-01-06T17:16:14,Partly cloudy throughout the day.,KMSY,obs
70062,1/5/2026,71.1,51.2,60.8,60.8,85.2,0,0,0,,6.9,76.1,1018,73.2,10,2026-01-05T06:57:48,2026-01-05T17:15:28,Partly cloudy throughout the day.,KMSY,obs
70062,1/4/2026,60.2,56,57.6,57.6,81.2,0,0,0,,13.9,8.4,1019,99.5,10,2026-01-04T06:57:40,2026-01-04T17:14:42,Cloudy skies throughout the day.,KMSY,obs
70062,1/3/2026,80.1,58.9,70.3,70.4,79.7,0.02,100,4.17,rain,17.2,252.4,1011,62.7,30,2026-01-03T06:57:30,2026-01-03T17:13:57,Partly cloudy throughout the day with afternoon rain.,KMSY,obs
70062,1/2/2026,74,52.1,64,64,79.7,0,0,0,,20.8,189.7,1012.7,80.5,10,2026-01-02T06:57:18,2026-01-02T17:13:13,Partly cloudy throughout the day.,KMSY,obs
70062,1/1/2026,70.1,38.9,54.6,54,62.7,0,0,0,,10.3,230.7,1020.4,44.5,10,2026-01-01T06:57:05,2026-01-01T17:12:30,Becoming cloudy in the afternoon.,KMSY,obs
70062,12/31/2025,61.1,29.9,46.7,44.8,50.4,0,0,0,,10.3,261,1025.6,5.2,10,2025-12-31T06:56:50,2025-12-31T17:11:48,Clear conditions throughout the day.,KMSY,obs
70062,12/30/2025,51.2,38,43,36.9,45.2,0,0,0,,19.7,339.8,1028.6,23.5,10,2025-12-30T06:56:34,2025-12-30T17:11:06,Clearing in the afternoon.,KMSY,obs
70062,12/29/2025,69.2,43.1,54.7,53.1,57.2,0.031,100,4.17,rain,20.8,334,1023.3,80,10,2025-12-29T06:56:16,2025-12-29T17:10:26,Partly cloudy throughout the day with early morning rain.,KMSY,obs
70062,12/28/2025,80.1,64.1,71.1,71.1,84.5,0,0,0,,13.9,179.3,1017.2,43.9,10,2025-12-28T06:55:57,2025-12-28T17:09:47,Partly cloudy throughout the day.,KMSY,obs
70062,12/27/2025,78.2,66.8,70.3,70.3,87.7,0,0,0,,12.8,189.1,1017.7,74.6,10,2025-12-27T06:55:36,2025-12-27T17:09:09,Partly cloudy throughout the day.,KMSY,obs
70062,12/26/2025,80.1,62.1,69.9,70,85.3,0,0,0,,11.4,208.2,1018.8,61.8,10,2025-12-26T06:55:14,2025-12-26T17:08:32,Partly cloudy throughout the day.,"KMSY,remote",obs
70062,12/25/2025,74.9,58.9,65.4,65.4,89.4,0,0,0,,8.1,75.5,1023.2,57.9,10,2025-12-25T06:54:50,2025-12-25T17:07:56,Clearing in the afternoon.,KMSY,obs
70062,12/24/2025,74.9,58.9,65.6,65.6,90.9,0,0,0,,6.9,119.4,1026.4,57.3,10,2025-12-24T06:54:25,2025-12-24T17:07:21,Clearing in the afternoon.,KMSY,obs
70062,12/23/2025,79.1,60.2,67.8,67.8,83.4,0,0,0,,11.4,122.1,1026.2,29.2,10,2025-12-23T06:53:58,2025-12-23T17:06:48,Partly cloudy throughout the day.,KMSY,obs
70062,12/22/2025,74.9,61.1,68.6,68.6,90.7,0,0,0,,11.4,105.6,1025.3,85,10,2025-12-22T06:53:30,2025-12-22T17:06:15,Partly cloudy throughout the day.,KMSY,obs
70062,12/21/2025,80.1,62.1,70.2,70.3,90.6,0.012,100,4.17,rain,10.3,169.4,1021.7,83,30,2025-12-21T06:53:01,2025-12-21T17:05:45,Partly cloudy throughout the day with afternoon rain.,KMSY,obs
70062,12/20/2025,73.1,42.2,59.7,59.6,76,0,0,0,,15,155.4,1019.6,25.6,10,2025-12-20T06:52:30,2025-12-20T17:05:15,Partly cloudy throughout the day.,KMSY,obs
70062,12/19/2025,65.9,47,56.1,56,47.1,0,0,0,,13.9,353.2,1020.8,16.2,10,2025-12-19T06:51:59,2025-12-19T17:04:47,Clear conditions throughout the day.,KMSY,obs
70062,12/18/2025,81.1,56,69.1,69.2,80,0,0,0,,18.3,209.2,1011.8,76.3,30,2025-12-18T06:51:26,2025-12-18T17:04:20,Partly cloudy throughout the day.,KMSY,obs
70062,12/17/2025,65,54.1,59.5,59.5,86.4,0,0,0,,17.2,72.6,1018.6,97.5,10,2025-12-17T06:50:52,2025-12-17T17:03:55,Cloudy skies throughout the day.,KMSY,obs
70062,12/16/2025,61.1,33.2,47.9,47.7,77.7,0,0,0,,10.3,70.1,1024,68.9,10,2025-12-16T06:50:16,2025-12-16T17:03:31,Partly cloudy throughout the day.,KMSY,obs
70062,12/15/2025,45,33.2,37.9,33.2,53.6,0,0,0,,15,34.3,1030.2,2.1,10,2025-12-15T06:49:40,2025-12-15T17:03:09,Clear conditions throughout the day.,KMSY,obs
70062,12/14/2025,62.1,39.8,51.8,48.2,73.5,0.082,100,8.33,rain,20.8,352,1025.6,46.4,10,2025-12-14T06:49:02,2025-12-14T17:02:48,Partly cloudy throughout the day with rain clearing later.,KMSY,obs
70062,12/13/2025,76.9,57.8,66.6,66.6,79.6,0,0,0,,12.8,160.8,1019,37,10,2025-12-13T06:48:24,2025-12-13T17:02:28,Partly cloudy throughout the day.,KMSY,obs
70062,12/12/2025,74.9,46.1,61.6,61.4,78.7,0,0,0,,9.2,151.5,1018,56.5,10,2025-12-12T06:47:44,2025-12-12T17:02:11,Partly cloudy throughout the day.,KMSY,obs
70062,12/11/2025,61.1,47,54.3,54.2,60.4,0,0,0,,13.9,76.6,1020,10.4,10,2025-12-11T06:47:04,2025-12-11T17:01:55,Clear conditions throughout the day.,KMSY,obs
70062,12/10/2025,73.1,39.8,56,55.9,77.6,0,0,0,,13.9,249.8,1016.9,24,10,2025-12-10T06:46:23,2025-12-10T17:01:40,Partly cloudy throughout the day.,KMSY,obs
70062,12/9/2025,53.1,44.1,48.2,46.3,73.9,0,0,0,,10.3,59.9,1022.6,54.8,10,2025-12-09T06:45:41,2025-12-09T17:01:27,Clearing in the afternoon.,KMSY,obs
70062,12/8/2025,57.8,48.8,53.9,53.4,76.5,0.11,100,8.33,rain,17.2,357.3,1021.3,94.5,10,2025-12-08T06:44:58,2025-12-08T17:01:16,Cloudy skies throughout the day with early morning rain.,KMSY,obs
70062,12/7/2025,66.8,55.1,59.3,59.3,88,0.051,100,4.17,rain,15,84.6,1014.8,80.8,10,2025-12-07T06:44:14,2025-12-07T17:01:06,Partly cloudy throughout the day with late afternoon rain.,KMSY,obs
70062,12/6/2025,55.1,51.2,53,53,91.7,0.063,100,12.5,rain,9.2,62.3,1016.4,99.5,10,2025-12-06T06:43:30,2025-12-06T17:00:58,Cloudy skies throughout the day with rain in the morning and afternoon.,KMSY,obs
70062,12/5/2025,52.1,48.8,50.9,49.8,89,0,0,0,,11.4,350.4,1017.7,100,10,2025-12-05T06:42:44,2025-12-05T17:00:52,Cloudy skies throughout the day.,KMSY,obs
70062,12/4/2025,61.1,52.1,56.4,56.4,93.7,3.135,100,66.67,rain,20.8,80.1,1017.8,100,10,2025-12-04T06:41:59,2025-12-04T17:00:47,Cloudy skies throughout the day with a chance of rain throughout the day.,KMSY,obs
70062,12/3/2025,53.1,42.2,47.3,45,74.2,0,0,0,,10.3,63.9,1021.1,89.7,10,2025-12-03T06:41:12,2025-12-03T17:00:44,Partly cloudy throughout the day.,KMSY,obs
70062,12/2/2025,57.8,43.1,47.9,43.6,82,0,0,0,,16.1,329.4,1017.4,96,10,2025-12-02T06:40:25,2025-12-02T17:00:43,Cloudy skies throughout the day.,KMSY,obs
70062,12/1/2025,61.1,52.1,56.1,56.1,87.6,0.209,100,12.5,rain,12.8,36.9,1018.6,100,10,2025-12-01T06:39:38,2025-12-01T17:00:43,Cloudy skies throughout the day with late afternoon rain.,KMSY,obs
70062,11/30/2025,66.5,55.1,61.7,61.7,85,0.008,100,4.17,rain,13.9,36.6,1021.1,79.8,10,2025-11-30T06:38:50,2025-11-30T17:00:46,Partly cloudy throughout the day with afternoon rain.,"KMSY,remote",obs
70062,11/29/2025,71.1,47.9,60.7,60.1,61.9,0,0,0,,17.2,109.2,1023.2,64.8,10,2025-11-29T06:38:02,2025-11-29T17:00:49,Partly cloudy throughout the day.,KMSY,obs
70062,11/28/2025,56.9,48.8,53.1,52.1,38,0,0,0,,17.2,39.5,1029.7,49.9,10,2025-11-28T06:37:13,2025-11-28T17:00:55,Partly cloudy throughout the day.,"E9083,KASD,KNEW,KHUM,KGAO,KMSY,KNBG,KHDC",obs
70062,11/27/2025,62.1,49.9,55.6,55.4,36,0,0,0,,17.2,18.2,1028,14.5,10,2025-11-27T06:36:24,2025-11-27T17:01:02,Clear conditions throughout the day.,"E9083,KASD,KNEW,KHUM,KGAO,KMSY,KNBG,KHDC",obs
70062,11/26/2025,67.9,56.9,64.4,64.4,62.9,0,0,0,,16.1,355.8,1022.6,73,10,2025-11-26T06:35:35,2025-11-26T17:01:11,Partly cloudy throughout the day.,"E9083,KASD,KNEW,KGAO,KMSY,KNBG,KHDC",obs
70062,11/25/2025,84.8,67.9,74.5,74.9,83.1,0.297,100,8.33,rain,16.1,208,1015.5,64.2,30,2025-11-25T06:34:46,2025-11-25T17:01:22,Partly cloudy throughout the day with rain clearing later.,"E9083,KASD,KNEW,KGAO,KMSY,KNBG,KHDC",obs
70062,11/24/2025,81,60.2,70.3,70.6,83.7,0.031,100,4.17,rain,12.7,125.5,1017.2,73.1,30,2025-11-24T06:33:56,2025-11-24T17:01:35,Becoming cloudy in the afternoon with afternoon rain.,"E9083,KASD,KNEW,KGAO,KMSY,KNBG,KHDC",obs
70062,11/23/2025,74,62.1,68.4,68.4,69.1,0,0,0,,11.4,7.4,1019.9,76,10,2025-11-23T06:33:06,2025-11-23T17:01:49,Partly cloudy throughout the day.,"E9083,KASD,KNEW,KHUM,KGAO,KMSY,KNBG,KHDC",obs
70062,11/22/2025,83.9,69.2,74.4,74.9,83.9,0,0,0,rain,8,246.4,1018.5,65.1,30,2025-11-22T06:32:16,2025-11-22T17:02:04,Partly cloudy throughout the day.,"E9083,KASD,KNEW,KGAO,KMSY,KNBG,KHDC",obs
70062,11/21/2025,84.8,70.1,76.1,76.7,80.3,0.012,100,4.17,rain,19.7,175.5,1016.2,72,30,2025-11-21T06:31:26,2025-11-21T17:02:22,Partly cloudy throughout the day with early morning rain.,"E9083,KASD,KNEW,KGAO,KMSY,KNBG,KHDC",obs
70062,11/20/2025,80.1,64.1,71.8,72,82.5,0,0,0,,12.7,133.5,1019.2,53.7,10,2025-11-20T06:30:36,2025-11-20T17:02:41,Partly cloudy throughout the day.,"E9083,KASD,KNEW,KGAO,KMSY,KNBG,KHDC",obs
70062,11/19/2025,80.1,62.2,70.9,71,83.1,0,0,0,rain,8,87.6,1021.4,63.7,10,2025-11-19T06:29:45,2025-11-19T17:03:02,Partly cloudy throughout the day.,"E9083,KASD,KNEW,KGAO,KMSY,KNBG,KHDC",obs
70062,11/18/2025,82.1,65,72.7,73.2,82.9,0,0,0,rain,13.8,153.2,1019,32.3,10,2025-11-18T06:28:55,2025-11-18T17:03:24,Partly cloudy throughout the day.,"E9083,KASD,KNEW,KHUM,KGAO,KMSY,KNBG,KHDC",obs
70062,11/17/2025,75.8,57.8,67.5,67.5,86.9,0,0,0,,6.9,85.9,1016,74.6,10,2025-11-17T06:28:05,2025-11-17T17:03:48,Partly cloudy throughout the day.,"E9083,KASD,KNEW,KGAO,KMSY,KNBG,KHDC",obs
70062,11/16/2025,80.1,56.9,69.1,69.2,79,0,0,0,rain,11.4,223.7,1013.6,29.7,10,2025-11-16T06:27:15,2025-11-16T17:04:14,Clearing in the afternoon.,"E9083,KASD,KNEW,KGAO,KMSY,KNBG,KHDC",obs
70062,11/15/2025,76.9,54.1,65.9,65.9,80.6,0,0,0,,11.4,170.1,1017.6,19.8,10,2025-11-15T06:26:25,2025-11-15T17:04:41,Clear conditions throughout the day.,"E9083,KASD,KNEW,KGAO,KMSY,KNBG,KHDC",obs
70062,11/14/2025,75.8,54.1,65.1,65.1,75.9,0,0,0,,8,139.3,1022.2,17.7,10,2025-11-14T06:25:35,2025-11-14T17:05:10,Clear conditions throughout the day.,"E9083,KASD,KNEW,KGAO,KMSY,KNBG,KHDC",obs
70062,11/13/2025,75.8,54,65,65,76.4,0,0,0,,6.9,175.2,1024,28.4,10,2025-11-13T06:24:45,2025-11-13T17:05:40,Becoming cloudy in the afternoon.,"USW00012916,E9083,USW00012958,USI0000KAPS,KASD,KNEW,KGAO,KMSY,KNBG,KHDC",obs
70062,11/12/2025,74,44.1,60.4,59.8,72.2,0,0,0,,13.8,146.7,1025.2,15.2,10,2025-11-12T06:23:56,2025-11-12T17:06:12,Clear conditions throughout the day.,"USW00012916,E9083,USW00012958,USI0000KAPS,USL000NWCL1,KASD,KNEW,KMSY,KNBG",obs
70062,11/11/2025,57.8,35.1,48.1,46.1,47.5,0,0,0,,9.2,113.3,1030.1,12.4,10,2025-11-11T06:23:06,2025-11-11T17:06:46,Clear conditions throughout the day.,"USW00012916,E9083,USW00012958,USI0000KAPS,KASD,KNEW,KMSY,KNBG",obs
70062,11/10/2025,55.1,44.1,48.9,45.1,45.2,0,0,0,,19.7,337.9,1030,13.3,10,2025-11-10T06:22:17,2025-11-10T17:07:20,Clear conditions throughout the day.,"USW00012916,E9083,USW00012958,USI0000KAPS,KNEW,KMSY,KNBG",obs
70062,11/9/2025,72,54,66.6,66.6,66.1,0,0,0,rain,20.8,330.3,1018.4,36,30,2025-11-09T06:21:28,2025-11-09T17:07:57,Partly cloudy throughout the day.,"USW00012916,E9083,USW00012958,USI0000KAPS,KNEW,KMSY,KNBG",obs
70062,11/8/2025,83.9,64.1,73,73.4,78.3,0,0,0,rain,11.4,227.6,1011.5,41.6,30,2025-11-08T06:20:40,2025-11-08T17:08:35,Partly cloudy throughout the day.,"USW00012916,E9083,USW00012958,USI0000KAPS,KASD,KNEW,KGAO,KMSY,KNBG,KHDC",obs
70062,11/7/2025,83,65,73.5,74.4,81.4,0,0,0,rain,13.8,161.6,1011.9,42.2,60,2025-11-07T06:19:52,2025-11-07T17:09:14,Partly cloudy throughout the day.,"USW00012916,E9083,USW00012958,USI0000KAPS,KASD,KNEW,KGAO,KMSY,KNBG,KHDC",obs
70062,11/6/2025,76.9,57.8,68.3,68.3,78.3,0,0,0,,11.4,89,1019,27.9,10,2025-11-06T06:19:04,2025-11-06T17:09:55,Partly cloudy throughout the day.,"USW00012916,E9083,USW00012958,USI0000KAPS,KNEW,E1090,KMSY,KNBG",obs
70062,11/5/2025,79,54,66.9,66.9,77.9,0,0,0,,9.2,96.2,1022.9,34.2,10,2025-11-05T06:18:16,2025-11-05T17:10:37,Partly cloudy throughout the day.,"USW00012916,E9083,USW00012958,USI0000KAPS,KNEW,KMSY,KNBG",obs
70062,11/4/2025,74.9,48.8,62.3,62.3,65.1,0,0,0,,12.7,69.6,1026.3,5.3,10,2025-11-04T06:17:29,2025-11-04T17:11:20,Clear conditions throughout the day.,"USW00012916,E9083,USW00012958,USI0000KAPS,KNEW,KMSY,KNBG",obs
70062,11/3/2025,69.2,54,59.9,59.9,56.9,0,0,0,,11.4,26.1,1026.2,4.4,10,2025-11-03T06:16:42,2025-11-03T17:12:05,Clear conditions throughout the day.,"USW00012916,E9083,USW00012958,USI0000KAPS,KASD,KNEW,KMSY,KNBG,USW00053865",obs
70062,11/2/2025,71.1,60.1,64.9,64.9,59.5,0,0,0,,11.4,359.2,1021.9,41.7,10,2025-11-02T06:15:55,2025-11-02T17:12:51,Clearing in the afternoon.,"USW00012916,E9083,USW00012958,USI0000KAPS,KNEW,KMSY,KNBG",obs
70062,11/1/2025,73.1,51.2,62.1,62.1,71.5,0,0,0,,11.4,62.5,1019.4,29.3,10,2025-11-01T07:15:09,2025-11-01T18:13:39,Partly cloudy throughout the day.,"USW00012916,E9083,USW00012958,USI0000KAPS,KNEW,KMSY,KNBG",obs
70062,10/31/2025,69.1,48.8,59,59,67.9,0,0,0,,9.1,347.1,1019.5,9.9,10,2025-10-31T07:14:23,2025-10-31T18:14:27,Clear conditions throughout the day.,"USW00012916,E9083,USW00012958,USI0000KAPS,KNEW,KGAO,KMSY,KNBG,KHDC",obs
70062,10/30/2025,66.8,56,60.4,60.4,63.2,0,0,0,,18.3,306.1,1017,40.2,10,2025-10-30T07:13:38,2025-10-30T18:15:17,Partly cloudy throughout the day.,"USW00012916,E9083,USW00012958,USI0000KAPS,KNEW,KGAO,KMSY,KNBG,KHDC",obs
70062,10/29/2025,74,57.8,65,65,58.5,0.078,100,4.17,rain,23,289.3,1013.7,41.3,10,2025-10-29T07:12:52,2025-10-29T18:16:08,Partly cloudy throughout the day with early morning rain.,"USW00012916,E9083,USW00012958,USI0000KAPS,USL000NWCL1,KNEW,KMSY,KNBG",obs
70062,10/28/2025,76.9,65.9,71.2,71.2,77.4,0,0,0,,10.3,78,1013.7,45.3,10,2025-10-28T07:12:08,2025-10-28T18:17:00,Clearing in the afternoon.,"USW00012916,E9083,USW00012958,USI0000KAPS,USL000NWCL1,KNEW,KMSY,KNBG",obs
70062,10/27/2025,82.1,71.1,75,75.1,73.1,0,0,0,,11.4,327.8,1012.9,14.7,30,2025-10-27T07:11:24,2025-10-27T18:17:54,Clear conditions throughout the day.,"USW00012916,E9083,USW00012958,USI0000KAPS,USL000NWCL1,KNEW,KMSY,KNBG",obs
70062,10/26/2025,82.1,72,76.8,77.9,84,1.869,100,29.17,rain,17.2,146.4,1013.7,62.7,30,2025-10-26T07:10:40,2025-10-26T18:18:48,Partly cloudy throughout the day with rain clearing later.,"USW00012916,E9083,USW00012958,USI0000KAPS,KASD,KNEW,KMSY,KNBG",obs
70062,10/25/2025,81,72,75.3,75.6,78.1,0.223,100,16.67,rain,15,117,1017.3,75.1,30,2025-10-25T07:09:56,2025-10-25T18:19:44,Partly cloudy throughout the day with afternoon rain.,"USW00012916,E9083,USW00012958,USI0000KAPS,KASD,KNEW,KMSY,KNBG",obs
70062,10/24/2025,83,60.2,72.9,73,64.2,0,0,0,,16.1,87.9,1020,40.9,10,2025-10-24T07:09:13,2025-10-24T18:20:41,Partly cloudy throughout the day.,"USW00012916,E9083,USW00012958,USI0000KAPS,KNEW,KMSY,KNBG",obs
70062,10/23/2025,81,57.8,69.8,69.7,61.9,0,0,0,,12.7,89,1020.7,47.3,10,2025-10-23T07:08:31,2025-10-23T18:21:38,Partly cloudy throughout the day.,"USW00012916,E9083,USW00012958,USI0000KAPS,USL000NWCL1,KASD,KNEW,KGAO,KMSY,KNBG",obs
70062,10/22/2025,81,63,73.9,73.7,48.2,0,0,0,,13.9,21.6,1019.9,45.4,10,2025-10-22T07:07:49,2025-10-22T18:22:37,Clearing in the afternoon.,"USW00012916,E9083,USW00012958,USI0000KAPS,KNEW,KMSY,KNBG",obs
70062,10/21/2025,88,66.8,77.4,78.4,72.3,0,0,0,,10.3,164.3,1017.5,44,10,2025-10-21T07:07:07,2025-10-21T18:23:37,Partly cloudy throughout the day.,"USW00012916,E9083,USW00012958,USI0000KAPS,KASD,KNEW,KMSY,KNBG,USW00053865",obs
70062,10/20/2025,83,65,73.6,73.6,54.7,0,0,0,,12.8,94.8,1019.6,7.1,10,2025-10-20T07:06:26,2025-10-20T18:24:37,Clear conditions throughout the day.,"USW00012916,E9083,USI0000KAPS,USW00012958,KASD,KNEW,KMSY,KNBG",obs
70062,10/19/2025,89.1,72,79.7,80.2,66.6,0.001,100,4.17,rain,17.2,318,1015.6,30.3,30,2025-10-19T07:05:45,2025-10-19T18:25:39,Partly cloudy throughout the day with early morning rain.,"USW00012916,E9083,USI0000KAPS,USW00012958,KASD,KNEW,KHUM,KGAO,KMSY,KNBG",obs
70062,10/18/2025,87.1,74,80.4,83.8,77.2,0.011,100,4.17,rain,18.3,143.6,1013.4,63.4,30,2025-10-18T07:05:05,2025-10-18T18:26:41,Partly cloudy throughout the day with morning rain.,"USW00012916,E9083,USI0000KAPS,USW00012958,KASD,KNEW,KMSY,KNBG,USW00053865",obs
70062,10/17/2025,87.1,67.9,77.4,78.5,73.4,0,0,0,rain,11.4,127.6,1014.1,37.8,10,2025-10-17T07:04:25,2025-10-17T18:27:44,Partly cloudy throughout the day.,"USW00012916,E9083,USI0000KAPS,USW00012958,KASD,KNEW,KMSY,KNBG",obs
70062,10/16/2025,88.1,65.9,76.3,76.8,73.5,0,0,0,,8,9.6,1014.4,13.4,10,2025-10-16T07:03:45,2025-10-16T18:28:48,Clear conditions throughout the day.,"USW00012916,E9083,USI0000KAPS,USW00012958,KASD,KNEW,KMSY,KNBG,USW00053865",obs
70062,10/15/2025,88.1,65.9,77,76.9,64.2,0,0,0,,11.4,53.1,1016,8,10,2025-10-15T07:03:06,2025-10-15T18:29:53,Clear conditions throughout the day.,"USW00012916,E9083,USI0000KAPS,USW00012958,KASD,KNEW,KMSY,KNBG",obs
70062,10/14/2025,85.9,64.1,75.7,75.6,60.7,0,0,0,,9.2,2.9,1017.2,0.9,10,2025-10-14T07:02:27,2025-10-14T18:30:59,Clear conditions throughout the day.,"USW00012916,E9083,USI0000KAPS,USW00012958,KASD,KNEW,KMSY,KNBG",obs
70062,10/13/2025,84.8,60.2,73.1,72.8,62.6,0,0,0,,6.9,322.3,1015,4.4,10,2025-10-13T07:01:49,2025-10-13T18:32:05,Clear conditions throughout the day.,"USW00012916,E9083,USI0000KAPS,KASD,KNEW,KMSY,KNBG",obs
70062,10/12/2025,84.8,63,74,73.6,56.1,0,0,0,,9.2,22,1012.2,9.7,10,2025-10-12T07:01:10,2025-10-12T18:33:12,Clear conditions throughout the day.,"USW00012916,E9083,USI0000KAPS,KASD,KNEW,KMSY,KNBG",obs
70062,10/11/2025,83,71.1,77.1,77.1,57.8,0,0,0,,12.7,29.9,1014.8,15,10,2025-10-11T07:00:33,2025-10-11T18:34:20,Clear conditions throughout the day.,"USW00012916,E9083,USI0000KAPS,KASD,KNEW,KMSY,KNBG",obs
70062,10/10/2025,83.9,73.1,78.3,79.1,63,0,0,0,rain,12.8,37.2,1018.4,26.2,10,2025-10-10T06:59:55,2025-10-10T18:35:28,Partly cloudy throughout the day.,"USW00012916,E9083,USL000NWCL1,USI0000KAPS,KASD,KNEW,KMSY,KNBG,USW00053865",obs
70062,10/9/2025,89.1,75.8,81.9,84.2,66.3,0,0,0,,12.8,18.1,1019.1,29.7,10,2025-10-09T06:59:18,2025-10-09T18:36:37,Partly cloudy throughout the day.,"USW00012916,E9083,USI0000KAPS,USL000NWCL1,USW00012958,KASD,KNEW,KMSY,KNBG,USW00053865",obs
70062,10/8/2025,91.1,76,83.1,88,76.6,0.001,100,4.17,rain,18.3,28.7,1018,53.1,30,2025-10-08T06:58:42,2025-10-08T18:37:47,Partly cloudy throughout the day with late afternoon rain.,"USW00012916,E9083,USI0000KAPS,USL000NWCL1,USW00012958,KASD,KNEW,KMSY,KNBG,USW00053865",obs
70062,10/7/2025,90,75.8,82.8,88.1,79.2,0,0,0,rain,8,64.9,1016.8,33.4,30,2025-10-07T06:58:05,2025-10-07T18:38:57,Partly cloudy throughout the day.,"USW00012916,E9083,USI0000KAPS,USW00012958,KASD,KNEW,KMSY,KNBG",obs
70062,10/6/2025,88,74.1,81.6,87.9,83.9,0.232,100,25,rain,13.9,137.2,1014.6,58.3,60,2025-10-06T06:57:29,2025-10-06T18:40:08,Partly cloudy throughout the day with a chance of rain throughout the day.,"USW00012916,E9083,USI0000KAPS,USW00012958,KASD,KNEW,KMSY,KNBG",obs
70062,10/5/2025,81,74,77.1,77.5,89.5,0.919,100,54.17,rain,17.2,80.9,1012.2,84.4,10,2025-10-05T06:56:54,2025-10-05T18:41:19,Partly cloudy throughout the day with a chance of rain throughout the day.,"USW00012916,E9083,USI0000KAPS,USW00012958,KASD,KNEW,KMSY,KNBG",obs
70062,10/4/2025,80.1,76.9,78.7,79.1,68.8,0.011,100,4.17,rain,19.7,60.3,1015.4,73.8,10,2025-10-04T06:56:18,2025-10-04T18:42:31,Partly cloudy throughout the day with late afternoon rain.,"USW00012916,E9083,USI0000KAPS,USW00012958,KASD,KNEW,KMSY,KNBG",obs
70062,10/3/2025,83,74.9,79.3,81.1,70.6,0.001,100,4.17,rain,17.2,66.5,1018.9,70.8,10,2025-10-03T06:55:43,2025-10-03T18:43:43,Partly cloudy throughout the day with early morning rain.,"USW00012916,E9083,USI0000KAPS,USW00012958,KASD,KNEW,KMSY,KNBG",obs
70062,10/2/2025,89.1,74,82.5,85,66.3,0,0,0,rain,18.3,70.2,1018.5,30.6,30,2025-10-02T06:55:08,2025-10-02T18:44:55,Partly cloudy throughout the day.,"USW00012916,E9083,USI0000KAPS,USW00012958,KASD,KNEW,KMSY,KNBG",obs
70062,10/1/2025,92,72,83.8,87.1,63.1,0,0,0,rain,12.7,65.4,1015.1,40.8,30,2025-10-01T06:54:34,2025-10-01T18:46:08,Partly cloudy throughout the day.,"USW00012916,E9083,USI0000KAPS,USL000NWCL1,USW00012958,KASD,KNEW,KMSY,KNBG,USW00053865",obs
70062,9/30/2025,91.1,74,82.6,84.5,66.3,0,0,0,,10.3,6,1014.7,55.6,30,2025-09-30T06:53:59,2025-09-30T18:47:21,Partly cloudy throughout the day.,"USW00012916,E9083,USI0000KAPS,USL000NWCL1,USW00012958,KASD,KNEW,KMSY,KNBG",obs
70062,9/29/2025,92.9,73.1,83.1,85.3,64.5,0,0,0,,10.3,30.1,1015.2,30.3,10,2025-09-29T06:53:25,2025-09-29T18:48:34,Partly cloudy throughout the day.,"USW00012916,E9083,USI0000KAPS,USW00012958,USL000NWCL1,KASD,KNEW,KMSY,KNBG,KHDC",obs
70062,9/28/2025,92,75.8,83.4,84.4,54.3,0,0,0,,11.4,33.3,1015,16.8,10,2025-09-28T06:52:51,2025-09-28T18:49:48,Clear conditions throughout the day.,"USW00012916,E9083,USI0000KAPS,USW00012958,KASD,KNEW,KMSY,KNBG",obs
70062,9/27/2025,89.1,73.1,81.8,83.1,62.2,0,0,0,,9.2,355.6,1012.6,16.4,10,2025-09-27T06:52:17,2025-09-27T18:51:02,Clear conditions throughout the day.,"USW00012916,E9083,USI0000KAPS,USW00012958,KASD,KNEW,KMSY,KNBG",obs
70062,9/26/2025,88.1,73.1,80.1,81.2,71.6,0.011,100,4.17,rain,8,326.8,1011.8,38.7,30,2025-09-26T06:51:44,2025-09-26T18:52:17,Partly cloudy throughout the day with early morning rain.,"USW00012916,E9083,USI0000KAPS,USW00012958,KASD,KNEW,KMSY,KNBG",obs
70062,9/25/2025,83.9,74.9,79.2,82.7,87.6,0.399,100,16.67,rain,10.3,234.6,1014.5,78.3,60,2025-09-25T06:51:11,2025-09-25T18:53:31,Partly cloudy throughout the day with rain clearing later.,"USW00012916,E9083,USI0000KAPS,USW00012958,KASD,KNEW,KMSY,KNBG",obs
70062,9/24/2025,92,76.9,83.6,91.1,80,0.172,100,12.5,rain,13.9,193.3,1016.2,64.5,60,2025-09-24T06:50:37,2025-09-24T18:54:46,Partly cloudy throughout the day with rain.,"USW00012916,E9083,USI0000KAPS,USL000NWCL1,USW00012958,KASD,KNEW,KMSY,KNBG,USW00053865,USW00003908",obs
70062,9/23/2025,92,75.8,83.3,89.5,78.2,0.001,100,4.17,rain,10.3,158.7,1015.5,43.2,30,2025-09-23T06:50:04,2025-09-23T18:56:01,Partly cloudy throughout the day with afternoon rain.,"USW00012916,E9083,USI0000KAPS,USW00012958,KASD,KNEW,KMSY,KNBG",obs
70062,9/22/2025,91.1,78.2,82.9,88.3,76.6,0.059,100,4.17,rain,13.8,133.5,1014.6,43.1,30,2025-09-22T06:49:31,2025-09-22T18:57:15,Partly cloudy throughout the day with afternoon rain.,"USW00012916,E9083,USI0000KAPS,USW00012958,KASD,KNEW,KMSY,KNBG,USW00053865",obs
70062,9/21/2025,91.1,73.1,82.7,86.4,70.5,0,0,0,rain,11.4,159.2,1016.1,60.9,30,2025-09-21T06:48:59,2025-09-21T18:58:31,Partly cloudy throughout the day.,"USW00012916,E9083,USI0000KAPS,USW00012958,KASD,KNEW,KMSY,KNBG,USW00053865",obs
70062,9/20/2025,92.9,72,82,85.4,72.3,0,0,0,,11.4,219.2,1017,38.2,30,2025-09-20T06:48:26,2025-09-20T18:59:46,Partly cloudy throughout the day.,"USW00012916,E9083,USI0000KAPS,USW00012958,KASD,KNEW,KMSY,KNBG",obs
70062,9/19/2025,92.9,74.9,82.4,85.6,70,0,0,0,,9.2,163.2,1016.6,23.9,30,2025-09-19T06:47:54,2025-09-19T19:01:01,Partly cloudy throughout the day.,"USW00012916,E9083,USI0000KAPS,USW00012958,KASD,KNEW,KMSY,KNBG",obs
70062,9/18/2025,90,71.1,80.8,83.3,70.5,0,0,0,rain,11.4,76.4,1016.2,21.3,10,2025-09-18T06:47:21,2025-09-18T19:02:16,Partly cloudy throughout the day.,"USW00012916,E9083,USI0000KAPS,USW00012958,KASD,KNEW,KMSY,KNBG",obs
70062,9/17/2025,92.9,73.1,82.5,83.8,65.2,0,0,0,,10.3,120.3,1017.2,36,30,2025-09-17T06:46:49,2025-09-17T19:03:31,Partly cloudy throughout the day.,"USW00012916,E9083,USI0000KAPS,USW00012958,USL000NWCL1,KASD,KNEW,KMSY,KNBG",obs
70062,9/16/2025,92,74,83,86.2,68.6,0,0,0,,9.1,233.2,1018.6,60.1,30,2025-09-16T06:46:16,2025-09-16T19:04:46,Partly cloudy throughout the day.,"USW00012916,E9083,USI0000KAPS,USW00012958,KASD,KNEW,KMSY,KNBG",obs
70062,9/15/2025,92,73.1,82.2,84.5,66.9,0,0,0,,8,262.6,1017.4,59.4,10,2025-09-15T06:45:44,2025-09-15T19:06:01,Partly cloudy throughout the day.,"USW00012916,E9083,USI0000KAPS,USW00012958,USL000NWCL1,KASD,KNEW,KGAO,KMSY,KNBG,KHDC",obs
70062,9/14/2025,91.1,74.9,82.9,85.4,66,0,0,0,rain,8,184.9,1015.4,40.3,30,2025-09-14T06:45:12,2025-09-14T19:07:16,Partly cloudy throughout the day.,"USW00012916,E9083,USI0000KAPS,USW00012958,KASD,KNEW,KMSY,KNBG",obs
70062,9/13/2025,93.8,74,83.6,86.5,66.9,0,0,0,,12.7,85.6,1016.2,28,30,2025-09-13T06:44:40,2025-09-13T19:08:31,Partly cloudy throughout the day.,"USW00012916,E9083,USI0000KAPS,USW00012958,KASD,KNEW,AV683,KMSY,KNBG",obs
70062,9/12/2025,94.9,73.1,83.3,85,64,0,0,0,,9.2,341.1,1018.5,13.3,30,2025-09-12T06:44:08,2025-09-12T19:09:46,Clear conditions throughout the day.,"USW00012916,E9083,USI0000KAPS,USW00012958,KASD,KNEW,AV683,KMSY,KNBG",obs
70062,9/11/2025,92,74.9,83.6,85.4,64.9,0,0,0,,13.8,47.3,1019.2,10.6,30,2025-09-11T06:43:36,2025-09-11T19:11:00,Clear conditions throughout the day.,"USW00012916,E9083,USI0000KAPS,USW00012958,KASD,KNEW,AV683,KMSY,KNBG",obs
70062,9/10/2025,91.1,80.1,84.2,90.6,71.5,0,0,0,rain,12.7,70.5,1017.8,41.8,30,2025-09-10T06:43:03,2025-09-10T19:12:15,Partly cloudy throughout the day.,"USW00012916,E9083,USW00012958,USI0000KAPS,KNEW,AV683,KMSY,KNBG",obs
70062,9/9/2025,91.1,76.9,83,86.9,64.8,0,0,0,rain,15,76.6,1015.5,38.2,30,2025-09-09T06:42:31,2025-09-09T19:13:29,Partly cloudy throughout the day.,"USW00012916,E9083,USI0000KAPS,USW00012958,KASD,KNEW,AV683,KMSY,KNBG",obs
70062,9/8/2025,85.9,74.9,80.9,80.6,45.3,0,0,0,,17.2,31.1,1017.1,24.6,10,2025-09-08T06:41:59,2025-09-08T19:14:42,Partly cloudy throughout the day.,"USW00012916,E9083,USW00012958,USI0000KAPS,USL000NWCL1,KASD,KNEW,AV683,KMSY,KNBG,USW00053865,KHDC",obs
70062,9/7/2025,91.1,78.1,83.9,87.4,63.5,0,0,0,,15,14.1,1017,48.4,30,2025-09-07T06:41:27,2025-09-07T19:15:56,Partly cloudy throughout the day.,"USW00012916,USW00012958,USI0000KAPS,KNEW,AV683,KMSY,KNBG",obs
70062,9/6/2025,92.9,75.8,85.2,91.3,70.1,0,0,0,,10.3,3.6,1015.6,44.4,30,2025-09-06T06:40:54,2025-09-06T19:17:09,Partly cloudy throughout the day.,"USW00012916,E9083,USW00012958,USI0000KAPS,KNEW,AV683,KMSY,KNBG",obs
70062,9/5/2025,92,74.9,84.1,89.7,71.5,0,0,0,,12.7,154.5,1014.1,31,60,2025-09-05T06:40:22,2025-09-05T19:18:22,Partly cloudy throughout the day.,"USW00012916,E9083,USW00012958,USI0000KAPS,KNEW,AV683,KMSY,KNBG",obs
70062,9/4/2025,92,74,83.1,86.9,70,0,0,0,,9.2,205.2,1012.3,21.2,30,2025-09-04T06:39:50,2025-09-04T19:19:35,Partly cloudy throughout the day.,"USW00012916,E9083,USW00012958,USI0000KAPS,KNEW,AV683,KMSY,KNBG",obs
70062,9/3/2025,92,72,81.9,84.6,69.3,0,0,0,,9.2,53.2,1013.3,34.2,10,2025-09-03T06:39:17,2025-09-03T19:20:47,Partly cloudy throughout the day.,"USW00012916,E9083,USW00012958,USI0000KAPS,KASD,KNEW,AV683,KGAO,KMSY,KNBG,USW00053865,KHDC",obs
70062,9/2/2025,90,76.9,82.9,85.3,65.3,0,0,0,,13.9,72.7,1015,53.1,10,2025-09-02T06:38:45,2025-09-02T19:21:59,Partly cloudy throughout the day.,"KASD,AV683,KGAO,KMSY,KNBG,USW00053865,USW00012916,E9083,USL000NWCL1,USI0000KAPS,USW00012958,KNEW,KHDC",obs
70062,9/1/2025,88.1,74.9,82.2,86.9,74.7,0,0,0,rain,15,75.7,1015.7,77.7,10,2025-09-01T06:38:12,2025-09-01T19:23:10,Partly cloudy throughout the day.,"KASD,KNEW,KHUM,AV683,KGAO,F1622,KMSY,KNBG,KHDC",obs
70062,8/31/2025,89.1,79.1,83.5,88.9,71.5,0,0,0,rain,11.4,63.4,1015.1,60.4,30,2025-08-31T06:37:39,2025-08-31T19:24:21,Partly cloudy throughout the day.,"KASD,KNEW,AV683,KGAO,KMSY,KNBG,KHDC",obs
70062,8/30/2025,88.1,75.8,81.9,87.1,80.3,0,0,0,rain,10.3,17.9,1014,68.4,30,2025-08-30T06:37:06,2025-08-30T19:25:31,Partly cloudy throughout the day.,"KASD,KNEW,AV683,KGAO,KMSY,KNBG,KHDC",obs
70062,8/29/2025,83.9,78.2,80.7,86.1,88,0.166,100,25,rain,7,197.4,1015.9,78.3,60,2025-08-29T06:36:33,2025-08-29T19:26:41,Partly cloudy throughout the day with rain.,"USW00012916,E9083,USW00012958,USI0000KAPS,KASD,KNEW,AV683,KGAO,KMSY,KNBG,USW00053865,KHDC",obs
70062,8/28/2025,91.1,79,84,91,75.4,0.688,100,16.67,rain,9.2,161.3,1018.1,50.7,30,2025-08-28T06:36:00,2025-08-28T19:27:50,Partly cloudy throughout the day with late afternoon rain.,"USW00012916,E9083,USW00012958,USI0000KAPS,KASD,KNEW,AV683,KMSY,KNBG",obs
70062,8/27/2025,90,76.9,83.5,89.2,71.4,0,0,0,,9.2,87,1020.5,48.4,30,2025-08-27T06:35:27,2025-08-27T19:28:59,Partly cloudy throughout the day.,"USW00012916,E9083,USW00012958,USI0000KAPS,USW00053917,KNEW,AV683,72231553917,KMSY,KNBG",obs
70062,8/26/2025,92,77,85.5,91.7,68,0,0,0,,13.8,75.9,1019,39.8,60,2025-08-26T06:34:54,2025-08-26T19:30:07,Partly cloudy throughout the day.,"USW00012916,E9083,USI0000KAPS,USW00012958,USW00053917,KNEW,AV683,72231553917,KMSY,KNBG",obs
70062,8/25/2025,94.9,77,86.7,92.5,65.1,0,0,0,,11.4,41.4,1015.7,25.2,60,2025-08-25T06:34:20,2025-08-25T19:31:15,Partly cloudy throughout the day.,"USW00012916,E9083,KASD,USW00053917,KNEW,AV683,72231553917,72231012916,KMSY,KNBG",obs
70062,8/24/2025,93.8,75.9,85,88.4,68.3,0,0,0,,9.2,327.6,1013.5,60.7,30,2025-08-24T06:33:47,2025-08-24T19:32:22,Partly cloudy throughout the day.,"72104600460,USW00053917,AV683,KMSY,KNBG,USW00053865,USW00012916,E9083,USI0000KAPS,KNEW,72231553917,72231012916,72233053865",obs
70062,8/23/2025,92.9,78.2,83.9,90,77.8,1.4,100,16.67,rain,12.6,288.6,1013.5,65.4,60,2025-08-23T06:33:13,2025-08-23T19:33:28,Partly cloudy throughout the day with rain.,"USW00012916,USW00053917,KNEW,AV683,72231553917,72231012916,KMSY,KNBG",obs
70062,8/22/2025,89.1,79.1,83.2,91.7,83.7,0.021,100,8.33,rain,12.8,84,1012.9,60.7,60,2025-08-22T06:32:39,2025-08-22T19:34:33,Partly cloudy throughout the day with afternoon rain.,"USW00012916,E9083,USW00053917,KNEW,AV683,72231553917,72231012916,KMSY,KNBG,72231612958",obs
70062,8/21/2025,92.9,78.2,83.2,90.1,80.5,0.457,100,4.17,rain,10.3,282.9,1011.4,61.8,60,2025-08-21T06:32:05,2025-08-21T19:35:38,Partly cloudy throughout the day with early morning rain.,"USW00012916,E9083,USW00053917,KNEW,AV683,72231553917,72231012916,KMSY,KNBG,72231612958",obs
70062,8/20/2025,96.1,77,86.3,94.4,73.2,0,0,0,rain,9.2,276.7,1012.4,43.9,60,2025-08-20T06:31:31,2025-08-20T19:36:42,Partly cloudy throughout the day.,"USW00012916,E9083,USW00053917,KNEW,AV683,72231553917,F1622,72231012916,KMSY,KNBG",obs
70062,8/19/2025,96.1,79.1,86.7,95.6,71.5,0,0,0,rain,9.2,351.7,1014.4,40,60,2025-08-19T06:30:57,2025-08-19T19:37:45,Partly cloudy throughout the day.,"USW00012916,E9083,USW00053917,KNEW,AV683,72231553917,72231012916,F1622,KMSY,KNBG",obs
70062,8/18/2025,94.9,78.2,85.1,93.3,77.2,0,0,0,rain,15,253.1,1014.3,61.6,75,2025-08-18T06:30:22,2025-08-18T19:38:48,Partly cloudy throughout the day.,"USW00012916,E9083,USW00053917,KNEW,AV683,72231553917,72231012916,KMSY,KNBG,72231612958",obs
70062,8/17/2025,98.1,79.1,87.3,97.6,73.5,0.219,100,4.17,rain,9.2,321.8,1015.1,54.9,100,2025-08-17T06:29:48,2025-08-17T19:39:49,Partly cloudy throughout the day with late afternoon rain.,"USW00012916,USW00053917,KNEW,AV683,72231553917,72231012916,KMSY,KNBG",obs
70062,8/16/2025,93.8,75,84.4,91,75.7,0,0,0,,8,304.8,1018.4,49.5,75,2025-08-16T06:29:13,2025-08-16T19:40:50,Partly cloudy throughout the day.,"USW00012916,USW00053917,KNEW,AV683,72231553917,72231012916,KMSY,KNBG,72231612958",obs
70062,8/15/2025,91.1,77,81.5,87.2,85.5,0.142,100,16.67,rain,9.2,237.7,1019.1,60.6,75,2025-08-15T06:28:38,2025-08-15T19:41:50,Partly cloudy throughout the day with afternoon rain.,"USW00012916,E9083,USW00053917,KNEW,AV683,72231553917,72231012916,KMSY,KNBG",obs
70062,8/14/2025,93.8,79.1,86.2,96.6,75,0,0,0,rain,8.1,221.2,1016.2,67.5,75,2025-08-14T06:28:03,2025-08-14T19:42:49,Partly cloudy throughout the day.,"USW00012916,E9083,USW00053917,KNEW,AV683,72231553917,72231012916,KMSY,KNBG,72231612958",obs
70062,8/13/2025,92.9,79.1,85.7,96.5,79.7,0,0,0,rain,9.2,215.1,1014.4,57.7,75,2025-08-13T06:27:28,2025-08-13T19:43:47,Partly cloudy throughout the day.,"USW00012916,E9083,KNEW,AV683,72231553917,72231012916,KMSY,KNBG",obs
70062,8/12/2025,89.1,81,84.6,95.7,81.1,0,0,0,rain,12.7,65.1,1014.1,84.1,60,2025-08-12T06:26:53,2025-08-12T19:44:44,Partly cloudy throughout the day.,"USW00012916,E9083,KNEW,AV683,72231553917,72231012916,KMSY,KNBG",obs
70062,8/11/2025,91.1,81,85.4,95.4,75.7,0,0,0,rain,15,71.3,1014.7,65,60,2025-08-11T06:26:18,2025-08-11T19:45:40,Partly cloudy throughout the day.,"USW00012916,E9083,KNEW,AV683,72231553917,72231012916,KMSY,KNBG",obs
70062,8/10/2025,90,80.1,85.1,95.4,76.9,0,0,0,rain,11.4,65,1015.6,56.3,60,2025-08-10T06:25:42,2025-08-10T19:46:35,Partly cloudy throughout the day.,"USW00012916,KNEW,AV683,72231553917,72231012916,KMSY,KNBG",obs
70062,8/9/2025,91.1,78.2,85.1,92.4,71.3,0,0,0,,13.9,63.4,1015.7,61.4,60,2025-08-09T06:25:07,2025-08-09T19:47:29,Partly cloudy throughout the day.,"USW00012916,KNEW,AV683,72231553917,72231012916,KMSY,KNBG",obs
70062,8/8/2025,90,75.9,83.2,89.1,78.1,0.727,100,12.5,rain,12.7,82.6,1016.4,61,60,2025-08-08T06:24:31,2025-08-08T19:48:23,Partly cloudy throughout the day with morning rain.,"USW00012916,KNEW,AV683,72231553917,72231012916,KMSY,KNBG",obs
70062,8/7/2025,92.9,78.2,84,91.8,79.1,0.206,100,8.33,rain,12.7,142,1019.7,62.1,75,2025-08-07T06:23:55,2025-08-07T19:49:15,Partly cloudy throughout the day with late afternoon rain.,"USW00012916,USW00012958,KNEW,AV683,72231553917,72231012916,KMSY,KNBG,72231612958",obs
70062,8/6/2025,92.9,77,84.3,92.5,78.2,0.716,100,8.33,rain,11.4,158.2,1021.4,67.2,60,2025-08-06T06:23:19,2025-08-06T19:50:05,Partly cloudy throughout the day with afternoon rain.,"USW00012916,KNEW,AV683,72231553917,72231012916,KMSY,KNBG",obs
70062,8/5/2025,91.1,80.1,84.5,93,74.9,0.001,100,4.17,rain,9.2,77.9,1018.4,84.5,60,2025-08-05T06:22:44,2025-08-05T19:50:55,Partly cloudy throughout the day with afternoon rain.,"USW00012916,E9083,KNEW,AV683,72231553917,72231012916,KMSY,KNBG",obs
70062,8/4/2025,92.9,83,87.1,93.7,61.6,0,0,0,rain,12.7,53,1014.1,79.8,30,2025-08-04T06:22:08,2025-08-04T19:51:44,Partly cloudy throughout the day.,"USW00012916,E9083,KNEW,AV683,72231553917,72231012916,KMSY,KNBG",obs
70062,8/3/2025,92,81,86,94.8,72.3,0,0,0,,9.2,345.4,1014.4,85.3,30,2025-08-03T06:21:32,2025-08-03T19:52:31,Partly cloudy throughout the day.,"USW00012916,E9083,KNEW,AV683,72231553917,72231012916,KMSY,KNBG",obs
70062,8/2/2025,91.1,79.1,84.6,93.6,79.2,0,0,0,rain,11.4,328.2,1017.5,74.9,60,2025-08-02T06:20:56,2025-08-02T19:53:18,Partly cloudy throughout the day.,"USW00012916,KNEW,AV683,72231553917,72231012916,KMSY,KNBG",obs
70062,8/1/2025,93.8,79.1,85.5,94.9,76.6,0,0,0,rain,11.4,249.5,1018.4,56.3,60,2025-08-01T06:20:20,2025-08-01T19:54:03,Partly cloudy throughout the day.,"USW00012916,KNEW,AV683,72231553917,72231012916,KMSY,KNBG",obs
70062,7/31/2025,93.8,74.9,84.5,91.2,74.9,0,0,0,rain,12.7,216.8,1016.8,49.5,60,2025-07-31T06:19:44,2025-07-31T19:54:47,Partly cloudy throughout the day.,"USW00012916,E9083,KNEW,AV683,72231553917,72231012916,KMSY,KNBG",obs
70062,7/30/2025,93.8,77,82.9,90.2,82.1,0.072,100,16.67,rain,17.2,238.1,1015.6,79.2,60,2025-07-30T06:19:08,2025-07-30T19:55:29,Partly cloudy throughout the day with rain.,"USW00012916,E9083,KNEW,AV683,72231553917,72231012916,KMSY,KNBG",obs
70062,7/29/2025,97,81,87.9,99.3,71.1,0.001,100,4.17,rain,11.4,310.5,1018.3,62.4,75,2025-07-29T06:18:32,2025-07-29T19:56:11,Partly cloudy throughout the day with late afternoon rain.,"USW00012916,E9083,KNEW,AV683,72231553917,72231012916,KMSY,KNBG",obs
70062,7/28/2025,97,80.1,87.7,99.6,74.7,0,0,0,,11.4,303.8,1021.1,34.5,75,2025-07-28T06:17:56,2025-07-28T19:56:51,Partly cloudy throughout the day.,"USW00012916,E9083,USW00012958,USI0000KAPS,USW00053917,KNEW,AV683,72231553917,72231012916,KMSY,KNBG,72231612958",obs
70062,7/27/2025,93.8,80.1,87.1,99.9,77,0.069,100,4.17,rain,10.3,178.6,1021.1,48,75,2025-07-27T06:17:21,2025-07-27T19:57:30,Partly cloudy throughout the day with morning rain.,"USW00012916,KNEW,AV683,72231553917,72231012916,KMSY,KNBG",obs
70062,7/26/2025,90,79.1,84.3,95.1,82.3,0.382,100,8.33,rain,12.9,166,1018.7,80.3,75,2025-07-26T06:16:45,2025-07-26T19:58:07,Partly cloudy throughout the day with afternoon rain.,"USW00012916,USW00012958,USI0000KAPS,USW00053917,KNEW,AV683,72231553917,72231012916,KMSY,KNBG,72231612958",obs
70062,7/25/2025,92,80.1,84.9,95,79,0.039,100,16.67,rain,18.3,140.2,1015.6,81.8,60,2025-07-25T06:16:10,2025-07-25T19:58:44,Partly cloudy throughout the day with rain.,"USW00012916,E9083,USW00012958,KNEW,AV683,72231553917,72231012916,KMSY,KNBG,72231612958",obs
70062,7/24/2025,90,78.2,82.1,89,87.9,2.113,100,20.83,rain,15.2,318,1016,91.3,60,2025-07-24T06:15:34,2025-07-24T19:59:18,Cloudy skies throughout the day with rain.,"USW00012916,E9083,KNEW,AV683,72231553917,72231012916,KMSY,KNBG",obs
70062,7/23/2025,96.2,78.2,86.8,99.6,78.1,0.067,100,12.5,rain,13.9,292.2,1017.1,78.8,75,2025-07-23T06:14:59,2025-07-23T19:59:52,Partly cloudy throughout the day with late afternoon rain.,"USW00012916,E9083,KNEW,AV683,72231553917,72231012916,KMSY,KNBG",obs
70062,7/22/2025,96.2,80.1,88,101,75.2,0,0,0,rain,10.3,270.1,1017,35.7,100,2025-07-22T06:14:24,2025-07-22T20:00:24,Partly cloudy throughout the day.,"USW00012916,E9083,KNEW,AV683,72231553917,72231012916,KMSY,KNBG",obs
70062,7/21/2025,93.8,79.1,86.2,98.3,78,0,0,0,rain,9.2,214.8,1018,45.8,100,2025-07-21T06:13:49,2025-07-21T20:00:55,Partly cloudy throughout the day.,"USW00012916,E9083,KNEW,AV683,72231553917,72231012916,KMSY,KNBG",obs
70062,7/20/2025,94.9,79.1,86.8,98.3,76.3,0,0,0,rain,11.4,189.6,1019.6,39.6,100,2025-07-20T06:13:15,2025-07-20T20:01:24,Partly cloudy throughout the day.,"USW00012916,KNEW,AV683,72231553917,72231012916,KMSY,KNBG",obs
70062,7/19/2025,91.1,80.1,84.8,96,81.6,0.191,100,12.5,rain,8,188.9,1020.4,65.1,75,2025-07-19T06:12:41,2025-07-19T20:01:52,Partly cloudy throughout the day with afternoon rain.,"USW00012916,E9083,KNEW,AV683,72231553917,72231012916,KMSY,KNBG",obs
70062,7/18/2025,92,77,83.2,90.2,82.6,0,0,0,rain,12.8,202.6,1018,89.8,60,2025-07-18T06:12:07,2025-07-18T20:02:19,Partly cloudy throughout the day.,"USW00012916,E9083,USW00053917,KNEW,AV683,72231553917,72231012916,KMSY,KNBG",obs
70062,7/17/2025,84.8,75.9,79.5,83.1,92.6,0.205,100,25,rain,11.4,250.7,1014.2,95.6,60,2025-07-17T06:11:34,2025-07-17T20:02:44,Cloudy skies throughout the day with rain.,"USW00012916,E9083,KNEW,AV683,72231553917,72231012916,KMSY,KNBG,72231612958",obs
70062,7/16/2025,92.9,79.1,85.8,98.1,80.5,0.543,100,20.83,rain,11.4,279,1015.2,87.7,75,2025-07-16T06:11:00,2025-07-16T20:03:08,Partly cloudy throughout the day with rain.,"USW00012916,E9083,KNEW,AV683,72231553917,72231012916,KMSY,KNBG",obs
70062,7/15/2025,94.9,74.9,85.1,93.1,76.5,0,0,0,,9.2,298.3,1017.6,50.9,75,2025-07-15T06:10:28,2025-07-15T20:03:30,Partly cloudy throughout the day.,"USW00012916,E9083,KNEW,AV683,72231553917,72231012916,KMSY,KNBG",obs
70062,7/14/2025,90,78.2,84.2,92.1,77.9,0,0,0,rain,9.2,227.3,1018.8,54.1,75,2025-07-14T06:09:55,2025-07-14T20:03:51,Partly cloudy throughout the day.,"USW00012916,E9083,KNEW,AV683,72231553917,72231012916,KMSY,KNBG",obs
70062,7/13/2025,92,78.2,83.3,90.3,77.9,0.029,100,12.5,rain,15,179.8,1019.1,57.3,75,2025-07-13T06:09:23,2025-07-13T20:04:10,Partly cloudy throughout the day with afternoon rain.,"USW00012916,KNEW,AV683,72231553917,72231012916,KMSY,KNBG",obs
70062,7/12/2025,91.1,79.1,85.4,94.9,76.6,0,0,0,rain,10.3,164.5,1018.9,50,75,2025-07-12T06:08:52,2025-07-12T20:04:28,Partly cloudy throughout the day.,"USW00012916,E9083,KNEW,AV683,72231553917,72231012916,KMSY,KNBG",obs
70062,7/11/2025,91.1,74.9,82,88.2,80.9,0.001,100,4.17,rain,11.4,190.2,1018.6,57.5,75,2025-07-11T06:08:21,2025-07-11T20:04:45,Partly cloudy throughout the day with afternoon rain.,"USW00012916,KNEW,AV683,72231553917,72231012916,KMSY,KNBG",obs
70062,7/10/2025,89.1,75.8,80.5,84.1,84.7,0,0,0,rain,25.2,251.6,1018.3,65.4,60,2025-07-10T06:07:51,2025-07-10T20:05:00,Partly cloudy throughout the day.,"USW00012916,E9083,KNEW,AV683,72231553917,72231012916,KMSY,KNBG",obs
70062,7/9/2025,88.1,75.8,80.9,85.1,83,0.927,100,8.33,rain,8,221.8,1019.7,54.3,60,2025-07-09T06:07:21,2025-07-09T20:05:14,Partly cloudy throughout the day with afternoon rain.,"USW00012916,E9083,KNEW,AV683,E1090,72231553917,72231012916,KMSY,KNBG",obs
70062,7/8/2025,89.9,75.9,82,87.1,79.6,0.419,100,12.5,rain,23.6,209.3,1020.4,48,60,2025-07-08T06:06:52,2025-07-08T20:05:26,Partly cloudy throughout the day with afternoon rain.,"USW00012916,KNEW,E1090,72231553917,72231012916,KMSY,KNBG",obs
70062,7/7/2025,92,77,84.1,90.5,74.7,0.013,100,8.33,rain,10.3,233.6,1018.1,45,60,2025-07-07T06:06:24,2025-07-07T20:05:36,Partly cloudy throughout the day with afternoon rain.,"USW00012916,KNEW,AV683,72231553917,E1090,72231012916,KMSY,KNBG",obs
70062,7/6/2025,93.8,77,84.7,91.6,73.3,0.001,100,4.17,rain,15,201.6,1015.9,44.7,75,2025-07-06T06:05:56,2025-07-06T20:05:46,Becoming cloudy in the afternoon with afternoon rain.,"USW00012916,KNEW,AV683,72231553917,72231012916,KMSY,KNBG",obs
70062,7/5/2025,96.2,77,86.6,90.2,66,0,0,0,rain,15,326.9,1016,34.2,60,2025-07-05T06:05:29,2025-07-05T20:05:54,Partly cloudy throughout the day.,"USW00012916,E9083,KNEW,AV683,72231553917,72231012916,KMSY,KNBG,72231612958",obs
70062,7/4/2025,92.9,78.2,84.9,92.2,73.3,0.012,100,4.17,rain,8,322.3,1016.5,65.1,60,2025-07-04T06:05:02,2025-07-04T20:06:00,Partly cloudy throughout the day with morning rain.,"USW00012916,E9083,KNEW,AV683,72231553917,72231012916,KMSY,KNBG",obs
70062,7/3/2025,91.4,79.1,83.7,93.3,84.3,0.053,100,8.33,rain,8,281.6,1015.9,77.2,60,2025-07-03T06:04:37,2025-07-03T20:06:05,Partly cloudy throughout the day with rain.,"USW00012916,E9083,KNEW,AV683,72231553917,72231012916,KMSY,KNBG",obs
70062,7/2/2025,91.1,79.1,83.5,92.5,81.2,0.593,100,12.5,rain,13.9,268.6,1016,68.1,75,2025-07-02T06:04:12,2025-07-02T20:06:08,Partly cloudy throughout the day with afternoon rain.,"USW00012916,E9083,KNEW,AV683,72231553917,72231012916,KMSY,KNBG",obs
70062,7/1/2025,92.9,79.1,85.7,94.2,76.9,0,0,0,,10.3,262.7,1017,59.9,60,2025-07-01T06:03:48,2025-07-01T20:06:10,Partly cloudy throughout the day.,"USW00012916,E9083,USW00012958,USI0000KAPS,USW00053917,KNEW,AV683,72231553917,72231012916,KMSY,KNBG,72231612958",obs
70062,6/30/2025,91.1,78.2,82.4,89.9,84.1,0.134,100,20.83,rain,17.2,203.9,1017.9,79,60,2025-06-30T06:03:25,2025-06-30T20:06:11,Partly cloudy throughout the day with rain.,"USW00012916,E9083,KNEW,AV683,72231553917,72231012916,KMSY,KNBG",obs
70062,6/29/2025,89.1,78.2,83.4,90.6,78.7,0.141,100,4.17,rain,19.3,191.4,1018.4,64.3,60,2025-06-29T06:03:03,2025-06-29T20:06:10,Partly cloudy throughout the day with afternoon rain.,"USW00012916,KNEW,AV683,72231553917,F1622,72231012916,KMSY,KNBG",obs
70062,6/28/2025,90,77,83.1,89.4,79,0.924,100,12.5,rain,12.7,157.1,1019.1,73.1,60,2025-06-28T06:02:41,2025-06-28T20:06:08,Partly cloudy throughout the day with afternoon rain.,"USW00012916,E9083,KNEW,AV683,72231553917,72231012916,F1622,KMSY,KNBG",obs
70062,6/27/2025,90,79.1,83.6,91.2,78.2,0.658,100,8.33,rain,13.8,189,1018.1,77,60,2025-06-27T06:02:21,2025-06-27T20:06:05,Partly cloudy throughout the day with rain in the morning and afternoon.,"USW00012916,E9083,KNEW,AV683,72231553917,72231012916,KMSY,KNBG,72231612958",obs
70062,6/26/2025,92,78.2,85.3,92.7,76,0,0,0,rain,10.3,39.7,1017.8,78.5,75,2025-06-26T06:02:02,2025-06-26T20:06:00,Partly cloudy throughout the day.,"USW00012916,E9083,KNEW,AV683,72231553917,72231012916,KMSY,KNBG",obs
70062,6/25/2025,92,78.2,85.2,93.6,74.9,0.085,100,8.33,rain,9.7,116.5,1020.2,64.8,75,2025-06-25T06:01:43,2025-06-25T20:05:54,Partly cloudy throughout the day with afternoon rain.,"USW00012916,E9083,KNEW,AV683,72231553917,72231012916,KMSY,KNBG",obs
70062,6/24/2025,90,78.2,84.1,91.5,76.1,0.459,100,20.83,rain,13.8,106.6,1021.5,77.9,75,2025-06-24T06:01:26,2025-06-24T20:05:46,Partly cloudy throughout the day with a chance of rain throughout the day.,"USW00012916,E9083,KNEW,AV683,72231553917,72231012916,KMSY,KNBG",obs
70062,6/23/2025,94.9,81,87.9,96.7,65.6,0,0,0,,15,89.7,1020.8,61.2,60,2025-06-23T06:01:10,2025-06-23T20:05:38,Partly cloudy throughout the day.,"USW00012916,E9083,KNEW,AV683,72231553917,72231012916,KMSY,KNBG",obs
70062,6/22/2025,93.8,82.1,87.9,98.6,69.7,0,0,0,,12.7,141.3,1020,60.6,75,2025-06-22T06:00:55,2025-06-22T20:05:28,Partly cloudy throughout the day.,"USW00012916,KNEW,AV683,72231553917,72231012916,KMSY,KNBG",obs
70062,6/21/2025,93.8,79.1,86.8,95.9,71.7,0,0,0,,9.1,138.8,1019,53.2,75,2025-06-21T06:00:41,2025-06-21T20:05:16,Partly cloudy throughout the day.,"USW00012916,KNEW,AV683,72231553917,72231012916,KMSY,KNBG",obs
70062,6/20/2025,93.8,75.8,84.8,93.1,76.3,0,0,0,rain,8,233.6,1019,52.5,75,2025-06-20T06:00:28,2025-06-20T20:05:04,Partly cloudy throughout the day.,"USW00012916,E9083,KNEW,AV683,72231553917,72231012916,KMSY,KNBG",obs
70062,6/19/2025,92.9,78.2,83.8,91.9,81.9,0.152,100,25,rain,9.2,190,1019.3,59.9,75,2025-06-19T06:00:16,2025-06-19T20:04:50,Partly cloudy throughout the day with rain.,"USW00012916,E9083,KNEW,AV683,72231553917,72231012916,KMSY,KNBG",obs
70062,6/18/2025,91.1,78.2,83.3,90.8,82.4,1.091,100,12.5,rain,14.9,168.7,1017.4,54.7,75,2025-06-18T06:00:05,2025-06-18T20:04:35,Partly cloudy throughout the day with afternoon rain.,"USW00012916,E9083,KNEW,AV683,72231553917,72231012916,KMSY,KNBG",obs
70062,6/17/2025,88.1,79.1,81.8,89,86.1,0.644,100,29.17,rain,13.8,189.3,1016.1,79.1,75,2025-06-17T05:59:56,2025-06-17T20:04:19,Partly cloudy throughout the day with rain.,"USW00012916,E9083,USW00012958,KNEW,AV683,72231553917,72231012916,KMSY,KNBG,72231612958",obs
70062,6/16/2025,85.9,75.9,80.4,84.8,84.6,0.309,100,16.67,rain,13.6,183.4,1016.8,77.9,75,2025-06-16T05:59:48,2025-06-16T20:04:02,Partly cloudy throughout the day with rain in the morning and afternoon.,"USW00012916,E9083,USW00012958,USI0000KAPS,USW00053917,KNEW,AV683,72231553917,72231012916,KMSY,KNBG,72231612958",obs
70062,6/15/2025,90,75.8,81.7,87.4,83.3,0.102,100,16.67,rain,15,175.8,1018.3,63.2,75,2025-06-15T05:59:41,2025-06-15T20:03:44,Partly cloudy throughout the day with rain.,"USW00012916,E9083,KNEW,AV683,72231553917,72231012916,KMSY,KNBG",obs
70062,6/14/2025,91.2,73.1,81.7,89,85.2,3.849,100,16.67,rain,11.4,174.3,1017.9,61.1,100,2025-06-14T05:59:36,2025-06-14T20:03:24,Partly cloudy throughout the day with rain.,"USW00012916,E9083,KNEW,AV683,72231553917,72231012916,KMSY,KNBG",obs
70062,6/13/2025,88.1,78.2,83.6,92.8,80.9,1.005,100,12.5,rain,13.9,165.7,1016.1,76.8,75,2025-06-13T05:59:31,2025-06-13T20:03:04,Partly cloudy throughout the day with rain in the morning and afternoon.,"USW00012916,E9083,KNEW,AV683,72231553917,72231012916,KMSY,KNBG,72231612958",obs
70062,6/12/2025,91.1,79.1,85.1,94.4,77.7,0,0,0,rain,16.1,144.8,1015.8,77.8,60,2025-06-12T05:59:29,2025-06-12T20:02:42,Partly cloudy throughout the day.,"USW00012916,E9083,USW00053917,KNEW,AV683,72231553917,72231012916,KMSY,KNBG",obs
70062,6/11/2025,91.1,73.1,80.8,85.7,79.9,0.271,100,4.17,rain,12.7,144.1,1017.5,82.4,75,2025-06-11T05:59:27,2025-06-11T20:02:20,Partly cloudy throughout the day with afternoon rain.,"USW00012916,E9083,KNEW,AV683,72231553917,72231012916,KMSY,KNBG",obs
70062,6/10/2025,93.8,72,82,87.2,81.8,0.237,100,20.83,rain,19.6,206.7,1015.8,78.8,75,2025-06-10T05:59:27,2025-06-10T20:01:56,Partly cloudy throughout the day with late afternoon rain.,"USW00012916,E9083,USW00053917,KNEW,AV683,72231553917,F1622,72231012916,KMSY,KNBG,72231612958",obs
70062,6/9/2025,90,80.1,83.7,92.6,80,0,0,0,rain,13.9,213.6,1013,77.7,60,2025-06-09T05:59:28,2025-06-09T20:01:32,Partly cloudy throughout the day.,"USW00053917,KMSY,KNBG,72231612958,USW00012916,E9083,USW00012958,USI0000KAPS,KNEW,E1090,72231553917,72231012916,F1622",obs
70062,6/8/2025,93.8,78.2,85.7,94.6,75.9,0.001,100,4.17,rain,13.9,218,1013.7,54,75,2025-06-08T05:59:30,2025-06-08T20:01:06,Partly cloudy throughout the day with afternoon rain.,"USW00012916,KNEW,E1090,72231553917,72231012916,KMSY,KNBG",obs
70062,6/7/2025,93.8,78.2,85.6,94.6,76.1,0,0,0,,12.7,219.9,1015.3,44.5,75,2025-06-07T05:59:34,2025-06-07T20:00:40,Partly cloudy throughout the day.,"USW00012916,E9083,KNEW,AV683,E1090,72231553917,72231012916,KMSY,KNBG",obs
70062,6/6/2025,92.9,77,84.1,91.6,78.1,0.151,100,8.33,rain,11.4,203.5,1016.5,62.9,60,2025-06-06T05:59:39,2025-06-06T20:00:13,Partly cloudy throughout the day with rain.,"USW00012916,E9083,KNEW,E1090,72231553917,72231012916,KMSY,KNBG",obs
70062,6/5/2025,91.1,77,84.5,91.3,73.4,0,0,0,,9.2,155.2,1015.8,61.4,30,2025-06-05T05:59:46,2025-06-05T19:59:45,Partly cloudy throughout the day.,"USW00012916,E9083,USW00012958,KNEW,72231553917,E1090,72231012916,KMSY,KNBG,72231612958",obs
70062,6/4/2025,90,77,83.9,89.1,71.8,0,0,0,rain,13.9,115.3,1014.6,63.8,30,2025-06-04T05:59:54,2025-06-04T19:59:16,Partly cloudy throughout the day.,"USW00012916,E9083,KNEW,E1090,72231553917,72231012916,KMSY,KNBG",obs
70062,6/3/2025,88,74,81.6,84.9,70.2,0,0,0,rain,17.2,96.4,1015,44.1,10,2025-06-03T06:00:03,2025-06-03T19:58:47,Partly cloudy throughout the day.,"USW00012916,E9083,USW00012958,USW00053917,KNEW,E1090,72231553917,72231012916,KMSY,KNBG,72231612958",obs
70062,6/2/2025,88.1,72.9,81.3,83.9,67.9,0,0,0,rain,11.4,137.2,1015.2,38,10,2025-06-02T06:00:14,2025-06-02T19:58:17,Becoming cloudy in the afternoon.,"USW00012916,E9083,USW00012958,USI0000KAPS,USW00053917,KNEW,E1090,72231553917,72231012916,KMSY,KNBG,72231612958",obs
70062,6/1/2025,88.1,68,79,79.9,64.9,0,0,0,rain,10.3,198.6,1013.7,42.5,10,2025-06-01T06:00:26,2025-06-01T19:57:46,Becoming cloudy in the afternoon.,"USW00012916,KNEW,E1090,72231553917,72231012916,KMSY,KNBG",obs
70062,5/31/2025,85.9,74.9,79.9,80.1,57.3,0,0,0,rain,11.4,2.7,1014.4,76.3,30,2025-05-31T06:00:40,2025-05-31T19:57:14,Partly cloudy throughout the day.,"USW00012916,KNEW,AV683,E1090,72231553917,72231012916,KMSY,KNBG",obs
70062,5/30/2025,90,74.9,80.6,84.6,83.4,0.001,100,4.17,rain,9.2,260.7,1015,75.1,60,2025-05-30T06:00:55,2025-05-30T19:56:42,Partly cloudy throughout the day with afternoon rain.,"USW00012916,E9083,USW00012958,KNEW,E1090,72231553917,72231012916,KMSY,KNBG,72231612958",obs
70062,5/29/2025,85.9,74,78.7,81.2,86.3,1.372,100,37.5,rain,14.9,101.6,1016.6,74.1,60,2025-05-29T06:01:11,2025-05-29T19:56:09,Partly cloudy throughout the day with a chance of rain throughout the day.,"USW00012916,E9083,USW00012958,KNEW,E1090,72231553917,72231012916,KMSY,KNBG,72231612958",obs
70062,5/28/2025,89.1,74,79.8,83.7,84,0.3,100,29.17,rain,18.3,214.6,1017.2,71.5,75,2025-05-28T06:01:29,2025-05-28T19:55:36,Partly cloudy throughout the day with rain.,"USW00012916,E9083,KNEW,E1090,72231553917,72231012916,KMSY,KNBG",obs
70062,5/27/2025,91.1,75.9,84.5,93.1,77,0.031,100,4.17,rain,12.8,184.4,1015.7,85.1,75,2025-05-27T06:01:48,2025-05-27T19:55:02,Partly cloudy throughout the day with morning rain.,"USW00012916,E9083,KNEW,E1090,72231553917,72231012916,KMSY,KNBG",obs
70062,5/26/2025,92,80.1,84.1,92.7,78.4,0.001,100,4.17,rain,16.1,169.7,1015.7,74.4,75,2025-05-26T06:02:09,2025-05-26T19:54:28,Partly cloudy throughout the day with morning rain.,"USW00012916,KNEW,E1090,72231553917,72231012916,KMSY,KNBG",obs
70062,5/25/2025,91.1,75.9,84.4,92.9,78.9,0,0,0,rain,12.8,173.1,1018,51.6,75,2025-05-25T06:02:31,2025-05-25T19:53:53,Partly cloudy throughout the day.,"USW00012916,USW00053917,KNEW,E1090,72231553917,72231012916,KMSY,KNBG",obs
70062,5/24/2025,89.1,72,80.2,85.6,81.8,0.283,100,20.83,rain,11.4,156.1,1017.7,70.7,75,2025-05-24T06:02:54,2025-05-24T19:53:18,Partly cloudy throughout the day with rain in the morning and afternoon.,"USW00012916,KNEW,AV683,E1090,72231553917,72231012916,KMSY,KNBG",obs
70062,5/23/2025,88.1,74,79.6,82.9,84.3,0.38,100,12.5,rain,11.4,152.9,1016.9,77.8,60,2025-05-23T06:03:19,2025-05-23T19:52:42,Partly cloudy throughout the day with afternoon rain.,"USW00012916,E9083,KNEW,72231553917,E1090,72231012916,KMSY,KNBG",obs
70062,5/22/2025,88.1,74,80.7,84,74.2,0,0,0,rain,12.7,99.6,1016.2,74.9,60,2025-05-22T06:03:45,2025-05-22T19:52:06,Partly cloudy throughout the day.,"USW00012916,E9083,KNEW,E1090,72231553917,72231012916,KMSY,KNBG",obs
70062,5/21/2025,82.1,77,79.9,81.2,73.5,0.012,100,8.33,rain,11.4,34.1,1014.6,83.9,60,2025-05-21T06:04:13,2025-05-21T19:51:30,Partly cloudy throughout the day with morning rain.,"USW00012916,E9083,KNEW,E1090,72231553917,72231012916,KMSY,KNBG",obs
70062,5/20/2025,91.1,79.1,83.9,92,78.1,0,0,0,rain,17.2,175.4,1011.1,72.1,60,2025-05-20T06:04:42,2025-05-20T19:50:53,Partly cloudy throughout the day.,"USW00012916,E9083,KNEW,72231553917,E1090,72231012916,KMSY,KNBG",obs
70062,5/19/2025,88.1,78.2,82.9,87.9,76.4,0,0,0,,18.3,150,1012.4,72.7,30,2025-05-19T06:05:12,2025-05-19T19:50:16,Partly cloudy throughout the day.,"USW00012916,E9083,KNEW,72231553917,E1090,72231012916,KMSY,KNBG",obs
70062,5/18/2025,89.1,76.9,82.2,87,79.9,0,0,0,rain,13.8,165.5,1014.1,71.5,30,2025-05-18T06:05:44,2025-05-18T19:49:38,Partly cloudy throughout the day.,"USW00012916,E9083,KNEW,72231553917,E1090,72231012916,KMSY,KNBG",obs
70062,5/17/2025,90,77,82.3,87.1,80.8,0,0,0,rain,16.1,175.4,1014.8,43.5,60,2025-05-17T06:06:17,2025-05-17T19:49:01,Partly cloudy throughout the day.,"USW00012916,E9083,KNEW,AV683,E1090,72231553917,72231012916,KMSY,KNBG",obs
70062,5/16/2025,90,77,82.4,87.8,81.6,0,0,0,,18.3,178.7,1014,63.9,60,2025-05-16T06:06:51,2025-05-16T19:48:23,Partly cloudy throughout the day.,"USW00012916,E9083,KNEW,E1090,72231553917,72231012916,KMSY,KNBG",obs
70062,5/15/2025,90,75.8,81.8,86.3,80.3,0,0,0,rain,15,172.8,1012.4,70.9,60,2025-05-15T06:07:27,2025-05-15T19:47:45,Partly cloudy throughout the day.,"USW00012916,KNEW,E1090,72231553917,72231012916,KMSY,KNBG,72231612958",obs
70062,5/14/2025,88,72,79.1,80.2,75.6,0,0,0,rain,20.8,180.4,1011.1,46.9,30,2025-05-14T06:08:04,2025-05-14T19:47:07,Becoming cloudy in the afternoon.,"USW00012916,E9083,KNEW,E1090,72231553917,72231012916,KMSY,KNBG",obs
70062,5/13/2025,87.1,64.1,74.9,75.2,72.5,0,0,0,,11.4,220.8,1012,27.6,30,2025-05-13T06:08:42,2025-05-13T19:46:29,Becoming cloudy in the afternoon.,"USW00012916,E9083,KNEW,AV683,72231553917,E1090,72231012916,KMSY,KNBG",obs
70062,5/12/2025,75.8,62.1,69.3,69.3,77.1,0,0,0,rain,11.4,244.2,1012.4,70.5,10,2025-05-12T06:09:21,2025-05-12T19:45:50,Partly cloudy throughout the day.,"USW00012916,KNEW,AV683,E1090,72231553917,72231012916,KMSY,KNBG",obs
70062,5/11/2025,75.8,59,67.8,67.8,78.8,0.001,100,4.17,rain,11.4,260.9,1013.8,67.4,10,2025-05-11T06:10:02,2025-05-11T19:45:12,Partly cloudy throughout the day with afternoon rain.,"USW00012916,E9083,KNEW,72231553917,E1090,72231012916,KMSY,KNBG",obs
70062,5/10/2025,76.9,65.9,70.2,70.2,82,0,0,0,rain,15,323.4,1012,81.8,10,2025-05-10T06:10:44,2025-05-10T19:44:33,Partly cloudy throughout the day.,"USW00012916,E9083,KNEW,E1090,72231553917,72231012916,KMSY,KNBG",obs
70062,5/9/2025,74.9,68,71.7,71.7,93.6,2.27,100,58.33,rain,20.8,32.4,1013.1,83.3,60,2025-05-09T06:11:27,2025-05-09T19:43:54,Partly cloudy throughout the day with rain.,"USW00012916,E9083,USW00053917,KNEW,E1090,72231553917,72231012916,KMSY,KNBG",obs
70062,5/8/2025,85.9,69.2,76.8,77.6,74.3,0,0,0,rain,9.1,23,1015.6,53.8,60,2025-05-08T06:12:11,2025-05-08T19:43:15,Partly cloudy throughout the day.,"USW00012916,E9083,KNEW,E1090,72231553917,72231012916,KMSY,KNBG,72231612958",obs
70062,5/7/2025,80.1,67.9,71.8,72,87.6,2.623,100,54.17,rain,23.1,49.4,1015.2,89.3,60,2025-05-07T06:12:57,2025-05-07T19:42:37,Partly cloudy throughout the day with a chance of rain throughout the day.,"USW00012916,E9083,KNEW,E1090,72231553917,72231012916,KMSY,KNBG",obs
70062,5/6/2025,83,70.1,76.9,78.5,83.6,0.122,100,8.33,rain,21.9,121.2,1013.3,91.1,60,2025-05-06T06:13:43,2025-05-06T19:41:58,Cloudy skies throughout the day with rain.,"USW00012916,E9083,USW00053917,KNEW,E1090,72231553917,72231012916,KMSY,KNBG,72231612958",obs
70062,5/5/2025,81,66.8,74.2,74.3,53.2,0,0,0,,15,61.3,1014.4,47.1,10,2025-05-05T06:14:31,2025-05-05T19:41:19,Partly cloudy throughout the day.,"USW00012916,E9083,USW00053917,KNEW,E1090,72231553917,72231012916,KMSY,KNBG,72231612958",obs
70062,5/4/2025,79.1,68,73.6,73.6,49.6,0,0,0,,11.4,357.2,1013.4,19.1,10,2025-05-04T06:15:20,2025-05-04T19:40:40,Clear conditions throughout the day.,"USW00012916,E9083,USW00053917,KNEW,72231553917,E1090,72231012916,KMSY,KNBG",obs
70062,5/3/2025,82.1,68,73.1,73.3,82.1,0.165,100,20.83,rain,14.9,271.6,1012.6,82,60,2025-05-03T06:16:10,2025-05-03T19:40:01,Partly cloudy throughout the day with rain.,"USW00012916,E9083,USW00012958,USW00053917,KNEW,E1090,72231553917,72231012916,KMSY,KNBG,72231612958",obs
70062,5/2/2025,83,70.1,77.2,78.5,82.2,0.012,100,4.17,rain,16.1,147.8,1014.5,79.8,75,2025-05-02T06:17:01,2025-05-02T19:39:22,Partly cloudy throughout the day with late afternoon rain.,"USW00012916,E9083,USW00053917,KNEW,E1090,72231553917,72231012916,KMSY,KNBG",obs
70062,5/1/2025,84.8,72,78.4,79.8,75.3,0,0,0,rain,16.1,146.6,1016.3,66.6,60,2025-05-01T06:17:53,2025-05-01T19:38:44,Partly cloudy throughout the day.,"USW00012916,E9083,USW00053917,KNEW,72231553917,E1090,72231012916,KMSY,KNBG,72231612958",obs
70062,4/30/2025,83.9,73.1,78.4,79.9,79.8,0,0,0,rain,19.6,141.1,1017.1,65,60,2025-04-30T06:18:46,2025-04-30T19:38:05,Partly cloudy throughout the day.,"USW00012916,E9083,KNEW,72231553917,E1090,72231012916,KMSY,KNBG,72231612958",obs
70062,4/29/2025,84.8,71.1,78.2,79.4,75.9,0,0,0,rain,13.9,139.8,1020.1,57.6,30,2025-04-29T06:19:40,2025-04-29T19:37:26,Partly cloudy throughout the day.,"USW00012916,E9083,USW00053917,KNEW,E1090,72231553917,72231012916,KMSY,KNBG,72231612958",obs
70062,4/28/2025,84.8,70.1,77.4,78.5,76.4,0,0,0,,12.7,158,1020,45,10,2025-04-28T06:20:35,2025-04-28T19:36:48,Partly cloudy throughout the day.,"USW00012916,E9083,USW00053917,KNEW,E1090,72231553917,72231012916,KMSY,KNBG,72231612958",obs
70062,4/27/2025,82.1,70.1,76.7,78.2,80.9,0.078,100,4.17,rain,18.3,176,1019,48.7,30,2025-04-27T06:21:31,2025-04-27T19:36:09,Partly cloudy throughout the day with afternoon rain.,"USW00012916,E9083,USW00053917,KNEW,E1090,72231553917,72231012916,KMSY,KNBG",obs
70062,4/26/2025,84.8,69.2,76.7,78.1,81.5,0,0,0,,8,230.4,1018.4,66.8,30,2025-04-26T06:22:27,2025-04-26T19:35:31,Partly cloudy throughout the day.,"USW00012916,E9083,USW00053917,KNEW,72231553917,E1090,72231012916,KMSY,KNBG",obs
70062,4/25/2025,83.9,70.1,77.1,78.4,82.7,0,0,0,rain,15,151.4,1018.2,76.6,30,2025-04-25T06:23:25,2025-04-25T19:34:53,Partly cloudy throughout the day.,"USW00012916,E9083,USW00053917,KNEW,E1090,72231553917,72231012916,KMSY,KNBG,72231612958",obs
70062,4/24/2025,82.1,73.1,76.7,77.7,84.2,0,0,0,rain,18.3,129.2,1017.6,88.3,30,2025-04-24T06:24:24,2025-04-24T19:34:15,Partly cloudy throughout the day.,"USW00012916,E9083,KNEW,E1090,72231553917,72231012916,KMSY,KNBG,72231612958",obs
70062,4/23/2025,82.1,72,76.7,77.7,82.6,0,0,0,rain,15,144,1017.5,86.2,30,2025-04-23T06:25:23,2025-04-23T19:33:37,Partly cloudy throughout the day.,"USW00012916,E9083,KNEW,E1090,72231553917,72231012916,KMSY,KNBG",obs
70062,4/22/2025,83,69.2,74.8,75.2,87.8,0.013,100,8.33,rain,11.4,153.6,1017.3,77.9,60,2025-04-22T06:26:23,2025-04-22T19:32:59,Partly cloudy throughout the day with afternoon rain.,"USW00012916,E9083,USW00053917,KNEW,E1090,72231553917,72231012916,KMSY,KNBG",obs
70062,4/21/2025,82.1,66.9,73.6,74.2,91.5,4.375,100,25,rain,16.1,109.9,1018.4,94.3,60,2025-04-21T06:27:25,2025-04-21T19:32:21,Cloudy skies throughout the day with rain.,"USW00012916,E9083,USW00053917,KNEW,E1090,72231553917,72231012916,KMSY,KNBG,72231612958",obs
70062,4/20/2025,83,72,76.3,77.2,81.7,0,0,0,rain,19.7,135.8,1019.1,90.8,30,2025-04-20T06:28:26,2025-04-20T19:31:43,Cloudy skies throughout the day.,"USW00012916,E9083,USW00053917,KNEW,E1090,72231553917,72231012916,KMSY,KNBG",obs
70062,4/19/2025,83,72,76.6,77.4,80.8,0,0,0,rain,20.8,130.9,1021,89.2,10,2025-04-19T06:29:29,2025-04-19T19:31:05,Partly cloudy throughout the day.,"USW00012916,E9083,USW00053917,KNEW,E1090,72231553917,72231012916,KMSY,KNBG",obs
70062,4/18/2025,82.1,70.1,76,76.7,78.5,0,0,0,,20.8,146.2,1019,46.1,10,2025-04-18T06:30:32,2025-04-18T19:30:28,Partly cloudy throughout the day.,"USW00012916,E9083,USW00053917,KNEW,E1090,72231553917,72231012916,KMSY,KNBG,72231612958",obs
70062,4/17/2025,80.1,59,70.5,70.6,72.8,0,0,0,,15,149.2,1019.1,15.6,10,2025-04-17T06:31:36,2025-04-17T19:29:50,Clear conditions throughout the day.,"USW00012916,E9083,KNEW,E1090,72231553917,72231012916,KMSY,KNBG,72231612958",obs
70062,4/16/2025,76.9,63,69.8,69.8,41.4,0,0,0,,12.8,91,1020.8,18.9,10,2025-04-16T06:32:41,2025-04-16T19:29:13,Clear conditions throughout the day.,"USW00012916,E9083,USW00053917,KNEW,E1090,72231553917,72231012916,KMSY,KNBG",obs
70062,4/15/2025,80.1,64.2,70.8,70.8,67.8,0,0,0,rain,12.7,322.5,1020.2,53.3,10,2025-04-15T06:33:46,2025-04-15T19:28:36,Partly cloudy throughout the day.,"USW00012916,E9083,KNEW,E1090,72231553917,72231012916,KMSY,KNBG,72231612958",obs
70062,4/14/2025,80.1,59,70.3,70.3,72.9,0,0,0,,12.8,200.2,1019.6,29.4,10,2025-04-14T06:34:52,2025-04-14T19:27:59,Partly cloudy throughout the day.,"USW00012916,E9083,USW00053917,KNEW,E1090,72231553917,72231012916,KMSY,KNBG",obs
70062,4/13/2025,80.1,54,67.8,67.8,67.3,0,0,0,,16.1,180.8,1020,6.5,10,2025-04-13T06:35:59,2025-04-13T19:27:22,Clear conditions throughout the day.,"USW00012916,USW00053917,KNEW,E1090,72231553917,72231012916,KMSY,KNBG",obs
70062,4/12/2025,74.9,56.9,67.4,67.4,49.8,0,0,0,,12.8,32.9,1020.9,6.7,10,2025-04-12T06:37:06,2025-04-12T19:26:45,Clear conditions throughout the day.,"USW00012916,E9083,USW00053917,KNEW,E1090,72231553917,72231012916,KMSY,KNBG",obs
70062,4/11/2025,80.1,64.1,71.3,71.2,58.4,0,0,0,rain,16.1,299.7,1019.7,9.6,10,2025-04-11T06:38:13,2025-04-11T19:26:08,Clear conditions throughout the day.,"USW00012916,E9083,USW00012958,USW00053917,KNEW,E1090,72231553917,72231012916,KMSY,KNBG,72231612958",obs
70062,4/10/2025,79.1,55.2,67.9,67.9,71.1,0,0,0,,11.4,232.5,1021.7,8.5,10,2025-04-10T06:39:21,2025-04-10T19:25:31,Clear conditions throughout the day.,"USW00012916,E9083,USW00053917,KNEW,E1090,72231553917,72231012916,KMSY,KNBG,72231612958",obs
70062,4/9/2025,74.9,53.1,64,64,64.2,0,0,0,,8.1,264.2,1021.7,6.4,10,2025-04-09T06:40:30,2025-04-09T19:24:55,Clear conditions throughout the day.,"USW00012916,E9083,USW00053917,KNEW,E1090,72231553917,72231012916,KMSY,KNBG",obs
70062,4/8/2025,71.1,48,60.3,60.1,60.4,0,0,0,,12.7,313.9,1019.1,8.5,10,2025-04-08T06:41:39,2025-04-08T19:24:18,Clear conditions throughout the day.,"USW00012916,E9083,USW00053917,KNEW,E1090,72231553917,72231012916,KMSY,KNBG,72231612958",obs
70062,4/7/2025,61.1,55.1,57.8,57.8,75.8,0.04,100,12.5,rain,20.8,318.8,1014.2,90.1,10,2025-04-07T06:42:48,2025-04-07T19:23:42,Cloudy skies throughout the day with morning rain.,"USW00012916,KNEW,E1090,72231553917,72231012916,KMSY,KNBG,72231612958",obs
70062,4/6/2025,79.1,60.2,69.7,69.7,93.4,0.658,100,29.17,rain,19.7,269.8,1010.7,100,60,2025-04-06T06:43:58,2025-04-06T19:23:05,Cloudy skies throughout the day with rain in the morning and afternoon.,"USW00012916,USW00053917,KNEW,E1090,72231553917,72231012916,KMSY,KNBG",obs
70062,4/5/2025,80.1,75.8,77.7,78,91.6,0,0,0,rain,27.7,153.7,1013.6,94.3,60,2025-04-05T06:45:09,2025-04-05T19:22:29,Cloudy skies throughout the day.,"USW00012916,USW00053917,KNEW,E1090,72231553917,72231012916,KMSY,KNBG",obs
70062,4/4/2025,83.9,79.1,80.8,84.8,83.3,0,0,0,rain,24.1,145.2,1016.7,94.2,60,2025-04-04T06:46:19,2025-04-04T19:21:52,Cloudy skies throughout the day.,"USW00012916,E9083,USW00053917,KNEW,E1090,72231553917,72231012916,KMSY,KNBG,72231612958",obs
70062,4/3/2025,83.9,77,80,83.6,85.6,0,0,0,rain,21.9,150.9,1014.1,95.1,60,2025-04-03T06:47:30,2025-04-03T19:21:16,Cloudy skies throughout the day.,"USW00012916,E9083,USW00053917,KNEW,AV683,E1090,72231553917,72231012916,KMSY,KNBG",obs
70062,4/2/2025,83,77,79.6,82.5,86.7,0,0,0,rain,26.4,152.1,1011.8,93.9,75,2025-04-02T06:48:41,2025-04-02T19:20:40,Cloudy skies throughout the day.,"USW00012916,E9083,USW00053917,KNEW,E1090,72231553917,72231012916,KMSY,KNBG,72231612958",obs
70062,4/1/2025,81,69.2,74.4,74.9,88.8,0,0,0,rain,17.2,116.8,1012.7,89,75,2025-04-01T06:49:53,2025-04-01T19:20:04,Partly cloudy throughout the day.,"USW00012916,E9083,KNEW,E1090,72231553917,72231012916,KMSY,KNBG",obs
70062,3/31/2025,79.1,66.8,73.6,73.6,91.7,1.381,100,12.5,rain,12.8,171.9,1011.4,82.2,60,2025-03-31T06:51:05,2025-03-31T19:19:27,Partly cloudy throughout the day with morning rain.,"USW00012916,E9083,USW00053917,KNEW,E1090,72231553917,72231012916,KMSY,KNBG,72231612958",obs
70062,3/30/2025,84.8,69.2,76,77.8,88,0,0,0,rain,17.2,164.2,1012.1,78.3,75,2025-03-30T06:52:16,2025-03-30T19:18:51,Partly cloudy throughout the day.,"USW00012916,USW00053917,KNEW,E1090,72231553917,72231012916,KMSY,KNBG,72231612958",obs
70062,3/29/2025,81,66.8,72.9,73,83.1,0.465,100,25,rain,23,137.1,1014.9,88.4,30,2025-03-29T06:53:29,2025-03-29T19:18:15,Partly cloudy throughout the day with a chance of rain throughout the day.,"USW00012916,USW00053917,KNEW,E1090,72231553917,72231012916,KMSY,KNBG",obs
70062,3/28/2025,79.1,70.1,73.3,73.3,76.2,0,0,0,rain,23,120.8,1019,93.3,30,2025-03-28T06:54:41,2025-03-28T19:17:38,Cloudy skies throughout the day.,"USW00012916,E9083,USW00053917,KNEW,E1090,72231553917,72231012916,KMSY,KNBG,72231612958",obs
70062,3/27/2025,80.1,68,73.2,73.2,72,0,0,0,,15,103.5,1021.9,92.4,10,2025-03-27T06:55:53,2025-03-27T19:17:02,Cloudy skies throughout the day.,"USW00012916,E9083,USW00053917,KNEW,E1090,72231553917,72231012916,KMSY,KNBG,72231612958",obs
70062,3/26/2025,83,63,72,72,79.4,0,0,0,,6.9,240.6,1022.2,77.5,10,2025-03-26T06:57:06,2025-03-26T19:16:26,Partly cloudy throughout the day.,"USW00012916,E9083,USW00012958,USW00053917,KNEW,E1090,72231553917,72231012916,KMSY,KNBG,72231612958",obs
70062,3/25/2025,83,57,70.1,70.2,78.1,0,0,0,rain,9.2,214.9,1019.9,36,10,2025-03-25T06:58:18,2025-03-25T19:15:49,Becoming cloudy in the afternoon.,"USW00012916,E9083,USW00053917,KNEW,E1090,72231553917,72231012916,KMSY,KNBG,72231612958",obs
70062,3/24/2025,74,63,68.2,68.2,89.2,0.649,100,20.83,rain,13.9,120,1016.6,74.1,30,2025-03-24T06:59:31,2025-03-24T19:15:13,Partly cloudy throughout the day with rain in the morning and afternoon.,"USW00012916,E9083,KNEW,E1090,72231553917,72231012916,KMSY,KNBG",obs
70062,3/23/2025,77,62.1,69.2,69.2,83.7,0,0,0,rain,19.7,150.2,1017.7,79.5,10,2025-03-23T07:00:44,2025-03-23T19:14:36,Partly cloudy throughout the day.,"USW00012916,USW00053917,KNEW,E1090,72231553917,72231012916,KMSY,KNBG",obs
70062,3/22/2025,74.9,52.1,64.4,64.4,68.6,0,0,0,,11.4,158.7,1020.5,54.9,10,2025-03-22T07:01:56,2025-03-22T19:14:00,Partly cloudy throughout the day.,"USW00012916,USW00053917,KNEW,E1090,72231553917,72231012916,KMSY,KNBG",obs
70062,3/21/2025,65.9,43.1,57.2,57.2,51.7,0,0,0,,12.7,151.6,1022.9,3.2,10,2025-03-21T07:03:09,2025-03-21T19:13:23,Clear conditions throughout the day.,"USW00012916,E9083,USW00053917,KNEW,E1090,72231553917,72231012916,KMSY,KNBG",obs
70062,3/20/2025,70.1,53.1,60.6,60.6,41.4,0,0,0,,21.9,307.7,1020.3,9.5,10,2025-03-20T07:04:22,2025-03-20T19:12:46,Clear conditions throughout the day.,"USW00012916,E9083,USW00053917,KNEW,E1090,72231553917,72231012916,KMSY,KNBG",obs
70062,3/19/2025,82.1,62.1,72,72.2,72.5,0,0,0,rain,17.2,194.8,1014.9,74,10,2025-03-19T07:05:34,2025-03-19T19:12:09,Partly cloudy throughout the day.,"USW00012916,E9083,USW00053917,KNEW,E1090,72231553917,72231012916,KMSY,KNBG,72231612958",obs
70062,3/18/2025,72,47.1,62.1,62.1,67.1,0,0,0,,17.2,158.8,1021.7,43.1,10,2025-03-18T07:06:46,2025-03-18T19:11:32,Partly cloudy throughout the day.,"USW00012916,E9083,USW00053917,KNEW,E1090,72231553917,72231012916,KMSY,KNBG",obs
70062,3/17/2025,72,45.1,60.4,60,46.7,0,0,0,,9.2,292.5,1025.8,10.6,10,2025-03-17T07:07:59,2025-03-17T19:10:54,Clear conditions throughout the day.,"USW00012916,E9083,USW00053917,KNEW,E1090,72231553917,72231012916,KMSY,KNBG",obs
70062,3/16/2025,71.1,57.9,64.4,64.4,47.5,0,0,0,,23,290.7,1013.9,4.3,10,2025-03-16T07:09:11,2025-03-16T19:10:17,Clear conditions throughout the day.,"USW00012916,E9083,USW00053917,KNEW,E1090,72231553917,72231012916,KMSY,KNBG",obs
70062,3/15/2025,80.1,66.8,74.9,75.4,89.1,0.938,100,8.33,rain,32.2,172.6,1001.4,82.2,60,2025-03-15T07:10:23,2025-03-15T19:09:39,Partly cloudy throughout the day with rain.,"USW00012916,USW00053917,KNEW,E1090,72231553917,72231012916,KMSY,KNBG",obs
70062,3/14/2025,80.1,65.9,73,73.3,91.5,0,0,0,rain,23,150.3,1009.3,89.5,30,2025-03-14T07:11:34,2025-03-14T19:09:01,Partly cloudy throughout the day.,"USW00012916,E9083,USW00053917,KNEW,E1090,72231553917,72231012916,KMSY,KNBG",obs
70062,3/13/2025,83,64.1,72.3,72.7,79.9,0,0,0,,13.8,202.5,1012.5,45.5,10,2025-03-13T07:12:45,2025-03-13T19:08:23,Partly cloudy throughout the day.,"USW00012916,E9083,USW00053917,KNEW,E1090,72231553917,72231012916,KMSY,KNBG,72231612958",obs
70062,3/12/2025,78.2,52.1,65.3,65.3,75.7,0,0,0,,18.3,175.8,1015.3,32.2,10,2025-03-12T07:13:56,2025-03-12T19:07:45,Partly cloudy throughout the day.,"USW00012916,E9083,USW00053917,KNEW,E1090,72231553917,72231012916,KMSY,KNBG",obs
70062,3/11/2025,74.9,48,61.4,61.3,62.2,0,0,0,,15,208.1,1016.9,8.6,10,2025-03-11T07:15:07,2025-03-11T19:07:07,Clear conditions throughout the day.,"USW00012916,E9083,USW00053917,KNEW,E1090,72231553917,72231012916,KMSY,KNBG",obs
70062,3/10/2025,72,52.1,59.4,59.4,63.8,0,0,0,rain,19.7,299.1,1016,47.2,10,2025-03-10T07:16:18,2025-03-10T19:06:28,Clearing in the afternoon.,"USW00012916,E9083,USW00053917,KNEW,E1090,72231553917,72231012916,KNBG,KMSY,72231612958",obs
70062,3/9/2025,70,54,63.9,63.9,86,0.18,100,4.17,rain,17.3,324.4,1011.9,90.2,10,2025-03-09T07:17:28,2025-03-09T19:05:49,Cloudy skies throughout the day with early morning rain.,"USW00012916,USW00053917,KNEW,E1090,72231553917,72231012916,KMSY,KNBG,72231612958",obs
70062,3/8/2025,76.9,64.1,69.9,69.9,88.5,0.118,100,12.5,rain,18.3,91.1,1012.3,94,10,2025-03-08T06:18:37,2025-03-08T18:05:10,Cloudy skies throughout the day with a chance of rain throughout the day.,"USW00012916,E9083,USW00053917,KNEW,E1090,72231553917,72231012916,KMSY,KNBG",obs
70062,3/7/2025,73.1,47.9,63,63,79.6,0.003,100,4.17,rain,17.2,149.2,1015.3,81,10,2025-03-07T06:19:46,2025-03-07T18:04:30,Partly cloudy throughout the day with late afternoon rain.,"USW00012916,USI0000KAPS,USW00053917,KNEW,E1090,72231553917,72231012916,KMSY,KNBG,72231612958",obs
70062,3/6/2025,65,51.2,56.4,56.4,41.7,0,0,0,,13.9,330.4,1019.1,33.1,10,2025-03-06T06:20:55,2025-03-06T18:03:50,Partly cloudy throughout the day.,"USW00012916,USI0000KAPS,USW00053917,KNEW,E1090,72231553917,72231012916,KMSY,KNBG,72231612958",obs
70062,3/5/2025,66.8,56,61.5,61.5,46.3,0,0,0,,24.1,275.6,1011.4,10,10,2025-03-05T06:22:03,2025-03-05T18:03:10,Clear conditions throughout the day.,"USW00012916,E9083,USW00053917,KNEW,AV683,72231553917,E1090,72231012916,KMSY,KNBG,72231612958",obs
70062,3/4/2025,74.9,57.8,66.3,66.3,84,0.54,100,8.33,rain,30,147.7,1008.1,84.9,30,2025-03-04T06:23:11,2025-03-04T18:02:30,Partly cloudy throughout the day with late afternoon rain.,"USW00012916,E9083,USW00053917,KNEW,AV683,72231553917,E1090,72231012916,KMSY,KNBG",obs
70062,3/3/2025,74,48.9,61.4,61.3,67.5,0,0,0,,18.3,106.7,1018.9,41.5,10,2025-03-03T06:24:18,2025-03-03T18:01:49,Partly cloudy throughout the day.,"USW00012916,E9083,USW00053917,KNEW,AV683,72231553917,72231012916,F1622,KMSY,KNBG",obs
70062,3/2/2025,66.8,52.1,59.4,59.4,42.1,0,0,0,,16.1,57.7,1021,20.1,10,2025-03-02T06:25:24,2025-03-02T18:01:08,Partly cloudy throughout the day.,"USW00012916,E9083,USW00053917,KNEW,AV683,E1090,72231553917,72231012916,KMSY,KNBG",obs
70062,3/1/2025,79,55.2,67,67,57.5,0,0,0,,16.1,325.4,1016.3,19.1,10,2025-03-01T06:26:30,2025-03-01T18:00:27,Clear conditions throughout the day.,"USW00012916,USW00053917,KNEW,E1090,72231553917,72231012916,KMSY,KNBG,72231612958",obs
70062,2/28/2025,72,54,63.3,63.3,57,0,0,0,,9.2,159,1019.1,63.2,10,2025-02-28T06:27:36,2025-02-28T17:59:45,Partly cloudy throughout the day.,"USW00012916,E9083,USW00053917,KNEW,E1090,72231553917,72231012916,KMSY,KNBG",obs
70062,2/27/2025,76.9,56,65.8,65.8,82.1,0,0,0,rain,11.4,339,1018.9,80.6,10,2025-02-27T06:28:40,2025-02-27T17:59:03,Partly cloudy throughout the day.,"USW00012916,E9083,USW00053917,KNEW,72231553917,E1090,72231012916,KMSY,KNBG,72231612958",obs
70062,2/26/2025,74,50,61.7,61.7,78.3,0,0,0,rain,13.9,167.6,1016.6,16.3,10,2025-02-26T06:29:44,2025-02-26T17:58:20,Clear conditions throughout the day.,"USW00012916,E9083,USW00053917,KNEW,E1090,72231553917,72231012916,KMSY,KNBG",obs
70062,2/25/2025,72,52.1,60.4,60.4,80.5,0,0,0,rain,10.3,312.5,1016.4,25,10,2025-02-25T06:30:47,2025-02-25T17:57:37,Partly cloudy throughout the day.,"USW00012916,E9083,USW00053917,KNEW,E1090,72231553917,72231012916,KMSY,KNBG",obs
70062,2/24/2025,65,48.8,56.1,55.2,92.4,0.155,100,20.83,rain,15,2.9,1016.1,91.1,10,2025-02-24T06:31:50,2025-02-24T17:56:54,Cloudy skies throughout the day with morning rain.,"USW00012916,E9083,USW00053917,KNEW,E1090,72231553917,72231012916,KMSY,KNBG,72231612958",obs
70062,2/23/2025,56.9,48.8,52.7,51.6,90.7,1.709,100,75,rain,16.1,70.4,1020.7,99.1,10,2025-02-23T06:32:51,2025-02-23T17:56:11,Cloudy skies throughout the day with a chance of rain throughout the day.,"USW00012916,KNEW,E1090,72231553917,72231012916,KMSY,KNBG,72231612958",obs
70062,2/22/2025,57.8,47,51.9,50.3,49,0,0,0,rain,10.3,40,1029.1,93.1,10,2025-02-22T06:33:52,2025-02-22T17:55:27,Cloudy skies throughout the day.,"USW00012916,E9083,USW00053917,KNEW,72231553917,E1090,72231012916,KMSY,KNBG",obs
70062,2/21/2025,47,33.2,40.5,35.4,49.6,0,0,0,,16.2,28.4,1032.9,55.7,10,2025-02-21T06:34:52,2025-02-21T17:54:42,Partly cloudy throughout the day.,"USW00012916,E9083,USW00053917,KNEW,E1090,72231553917,72231012916,KMSY,KNBG,72231612958",obs
70062,2/20/2025,44.1,29.9,36.7,27.7,58.7,0,0,0,rain,20.8,352.8,1029.5,36.6,10,2025-02-20T06:35:51,2025-02-20T17:53:58,Clearing in the afternoon.,"USW00012916,E9083,USW00053917,KNEW,E1090,72231553917,72231012916,KMSY,KNBG,72231612958",obs
70062,2/19/2025,57.3,35.9,47.7,43,92.2,2.114,100,29.17,rain,19.7,350.3,1020.1,100,10,2025-02-19T06:36:49,2025-02-19T17:53:13,Cloudy skies throughout the day with rain clearing later.,"USW00012916,E9083,USI0000KAPS,USW00053917,KNEW,E1090,72231553917,72231012916,KMSY,KNBG,72231612958",obs
70062,2/18/2025,61.1,45.2,54.6,54.1,78.6,0.33,100,12.5,rain,17.2,87.5,1020,79.5,10,2025-02-18T06:37:46,2025-02-18T17:52:27,Partly cloudy throughout the day with late afternoon rain.,"USW00012916,E9083,USW00053917,KNEW,E1090,72231553917,72231012916,KMSY,KNBG,72231612958",obs
70062,2/17/2025,56,41,47.2,43.3,61.1,0,0,0,,16.1,28.8,1024.6,24.4,10,2025-02-17T06:38:42,2025-02-17T17:51:41,Partly cloudy throughout the day.,"USW00012916,USW00053917,KNEW,E1090,72231553917,72231012916,KMSY,KNBG",obs
70062,2/16/2025,74.9,47,60.1,59.5,72.8,0.071,100,4.17,rain,22.7,318.2,1017.3,50.5,30,2025-02-16T06:39:38,2025-02-16T17:50:55,Partly cloudy throughout the day with early morning rain.,"USW00012916,USW00053917,KNEW,E1090,72231553917,72231012916,KMSY,KNBG",obs
70062,2/15/2025,81,66.8,73.5,73.7,88.7,0.005,100,4.17,rain,23,158.4,1015.3,91.7,30,2025-02-15T06:40:32,2025-02-15T17:50:08,Cloudy skies throughout the day with late afternoon rain.,"USW00012916,USW00053917,KNEW,E1090,72231553917,72231012916,KMSY,KNBG",obs
70062,2/14/2025,66.8,48.3,57,55.9,75.9,0,0,0,rain,18.3,74.3,1027.4,85.3,10,2025-02-14T06:41:25,2025-02-14T17:49:21,Partly cloudy throughout the day.,"USW00012916,E9083,USW00053917,KNEW,72231553917,E1090,72231012916,KMSY,KNBG",obs
70062,2/13/2025,66.2,51.8,56.5,56.5,76.6,0.005,100,4.17,rain,16.1,356.2,1022.8,83.2,10,2025-02-13T06:42:17,2025-02-13T17:48:34,Partly cloudy throughout the day with early morning rain.,"USW00012916,E9083,KNEW,E1090,72231553917,72231012916,KMSY,KNBG",obs
70062,2/12/2025,83,64.1,72.7,73.6,90.9,0.516,100,29.17,rain,20.9,180.4,1008.6,86.6,60,2025-02-12T06:43:08,2025-02-12T17:47:46,Partly cloudy throughout the day with a chance of rain throughout the day.,"USW00012916,E9083,KNEW,E1090,72231553917,72231012916,KMSY,KNBG",obs
70062,2/11/2025,82.1,64.2,72.4,72.7,85.9,0.126,100,8.33,rain,15,179.6,1014.4,88.3,10,2025-02-11T06:43:57,2025-02-11T17:46:58,Partly cloudy throughout the day with late afternoon rain.,"USW00012916,E9083,USW00053917,KNEW,E1090,72231553917,72231012916,KMSY,KNBG",obs
70062,2/10/2025,70.1,64.1,67.5,67.5,90.8,0,0,0,rain,11.4,31.4,1021.7,97.1,10,2025-02-10T06:44:46,2025-02-10T17:46:09,Cloudy skies throughout the day.,"USW00012916,E9083,USW00053917,KNEW,E1090,72231553917,72231012916,KMSY,KNBG,72231612958",obs
70062,2/9/2025,76.9,67.9,70.8,70.8,95.2,0.114,100,16.67,rain,10.3,119.6,1020.4,87.8,10,2025-02-09T06:45:33,2025-02-09T17:45:20,Partly cloudy throughout the day with rain.,"USW00012916,USW00053917,KNEW,E1090,72231553917,72231012916,KMSY,KNBG",obs
70062,2/8/2025,83.9,66.8,73.8,74.4,84.5,0,0,0,rain,17.2,189.1,1018.7,60.8,10,2025-02-08T06:46:20,2025-02-08T17:44:31,Partly cloudy throughout the day.,"USW00012916,USW00053917,KNEW,E1090,72231553917,72231012916,KMSY,KNBG,72231612958",obs
70062,2/7/2025,78.2,60.2,69.1,69.1,90.5,0,0,0,rain,8.1,112.5,1020.3,70.5,10,2025-02-07T06:47:04,2025-02-07T17:43:41,Partly cloudy throughout the day.,"USW00012916,KNEW,E1090,72231553917,72231012916,KMSY,KNBG,72231612958",obs
70062,2/6/2025,79,66.9,71.9,71.9,91.4,0.032,100,8.33,rain,12.7,171.6,1018.7,75.3,10,2025-02-06T06:47:48,2025-02-06T17:42:51,Partly cloudy throughout the day with afternoon rain.,"USW00012916,E9083,KNEW,E1090,72231553917,72231012916,KMSY,KNBG,72231612958",obs
70062,2/5/2025,77,63,69.8,69.8,88.4,0,0,0,,10.3,147.4,1020.3,80.4,10,2025-02-05T06:48:30,2025-02-05T17:42:01,Partly cloudy throughout the day.,"USW00012916,E9083,USW00053917,KNEW,E1090,72231553917,72231012916,KMSY,KNBG",obs
70062,2/4/2025,74.9,65,69.2,69.2,89.9,0,0,0,rain,6.9,135.6,1022,97.2,10,2025-02-04T06:49:11,2025-02-04T17:41:10,Cloudy skies throughout the day.,"USW00012916,E9083,USW00053917,KNEW,AV683,72231553917,E1090,72231012916,KMSY,KNBG",obs
70062,2/3/2025,75.8,53.1,64.7,64.7,86.8,0,0,0,rain,12.7,161.4,1021,40.4,10,2025-02-03T06:49:51,2025-02-03T17:40:19,Partly cloudy throughout the day.,"USW00012916,E9083,USW00053917,KNEW,AV683,E1090,72231553917,72231012916,F1622,KMSY,KNBG,72231612958",obs
70062,2/2/2025,72,46.2,58.5,58.5,74.9,0,0,0,,9.2,136.9,1022.5,17.1,10,2025-02-02T06:50:29,2025-02-02T17:39:28,Clear conditions throughout the day.,"USW00012916,E9083,USW00053917,KNEW,E1090,72231553917,72231012916,KMSY,KNBG",obs
70062,2/1/2025,68,51.2,58.5,58.5,60.8,0,0,0,,10.3,26.7,1022.5,29.3,10,2025-02-01T06:51:06,2025-02-01T17:38:37,Partly cloudy throughout the day.,"USW00012916,USW00053917,KNEW,E1090,72231553917,72231012916,KMSY,KNBG",obs
70062,1/31/2025,75.8,56.9,66,66,64.5,0,0,0,rain,23,249.3,1016.2,82.7,10,2025-01-31T06:51:41,2025-01-31T17:37:45,Partly cloudy throughout the day.,"USW00012916,E9083,USW00053917,KNEW,72231553917,E1090,72231012916,KMSY,KNBG,72231612958",obs
70062,1/30/2025,77,64.1,70.4,70.4,90.6,0,0,0,rain,24.1,144.8,1016,88.8,10,2025-01-30T06:52:15,2025-01-30T17:36:53,Partly cloudy throughout the day.,"USW00012916,E9083,USW00053917,KNEW,E1090,72231553917,72231012916,KMSY,KNBG,72231612958",obs
70062,1/29/2025,71.1,50,60.8,60.8,81.7,0,0,0,rain,15,86.9,1020.2,79.7,10,2025-01-29T06:52:48,2025-01-29T17:36:01,Partly cloudy throughout the day.,"USW00012916,E9083,USI0000KAPS,KNEW,E1090,72231553917,72231012916,KMSY,KNBG,72231612958",obs
70062,1/28/2025,60.2,50,52.9,52.2,87.6,0,0,0,rain,6.9,23.2,1021.6,80.2,10,2025-01-28T06:53:19,2025-01-28T17:35:09,Partly cloudy throughout the day.,"USW00012916,E9083,KNEW,E1090,72231553917,72231012916,KMSY,KNBG",obs
70062,1/27/2025,66.8,54,59.5,59.5,91.8,0,0,0,rain,11.4,297.1,1021.6,82.2,10,2025-01-27T06:53:48,2025-01-27T17:34:17,Partly cloudy throughout the day.,"USW00012916,USI0000KAPS,KNEW,E1090,72231553917,72231012916,KMSY,KNBG",obs
70062,1/26/2025,68,51.2,60,60,76.4,0,0,0,rain,17.2,131.3,1026.2,94.4,10,2025-01-26T06:54:16,2025-01-26T17:33:24,Cloudy skies throughout the day.,"USW00012916,USW00053917,KNEW,E1090,72231553917,72231012916,KMSY,KNBG,72231612958",obs
70062,1/25/2025,56.9,30,44.3,42.5,67.5,0,0,0,,14.9,80.5,1030.2,29,10,2025-01-25T06:54:43,2025-01-25T17:32:32,Partly cloudy throughout the day.,"USW00012916,USW00053917,KNEW,AV683,72231553917,E1090,72231012916,KMSY,KNBG",obs
70062,1/24/2025,53.1,34.1,42.1,40.1,64,0,0,0,,13.8,315.3,1031,33.1,10,2025-01-24T06:55:08,2025-01-24T17:31:39,Clearing in the afternoon.,"USW00012916,E9083,KNEW,AV683,E1090,72231553917,72231012916,KMSY,KNBG",obs
70062,1/23/2025,47.9,23,34.6,32.9,71.1,0,0,0,,6.9,316.4,1030.1,50.7,10,2025-01-23T06:55:31,2025-01-23T17:30:47,Partly cloudy throughout the day.,"KASD,KMSY,KNBG,72231612958,USW00012916,E9083,USW00012958,USI0000KAPS,KNEW,E1090,72231553917,72231012916,72233053865",obs
70062,1/22/2025,34.1,22.9,27.9,23.1,63.8,0,0,0,,9.3,22.6,1032.5,34.6,10,2025-01-22T06:55:53,2025-01-22T17:29:54,Partly cloudy throughout the day.,"KASD,USW00053917,KMSY,KNBG,72231612958,USW00012916,E9083,USW00012958,USI0000KAPS,KNEW,E1090,72231553917,72231012916,72233053865",obs
70062,1/21/2025,38,27,30.3,19.6,70,0.208,100,45.83,"snow,ice",22,6.7,1033.8,88.3,10,2025-01-21T06:56:13,2025-01-21T17:29:02,Partly cloudy throughout the day with snow in the morning and afternoon.,"USW00012916,USW00053917,KNEW,E1090,72231553917,72231012916,KMSY,KNBG",obs
70062,1/20/2025,41,29.9,35.5,27.3,40.9,0,0,0,"snow,ice",17.3,22.9,1032.2,47.2,10,2025-01-20T06:56:31,2025-01-20T17:28:09,Becoming cloudy in the afternoon.,"USW00012916,E9083,USW00053917,KNEW,E1090,72231553917,72231012916,KMSY,KNBG",obs
70062,1/19/2025,56.9,36,46.2,40.6,61.4,0,0,0,,19.8,333.4,1022.7,25.5,10,2025-01-19T06:56:48,2025-01-19T17:27:17,Clearing in the afternoon.,"USW00012916,USW00053917,KNEW,E1090,72231553917,72231012916,KMSY,KNBG",obs
70062,1/18/2025,71.1,60.2,64.7,64.7,91.5,0.443,100,16.67,rain,10.3,220.5,1010.6,63.8,10,2025-01-18T06:57:03,2025-01-18T17:26:25,Partly cloudy throughout the day with morning rain.,"USW00012916,E9083,USW00053917,KNEW,E1090,72231553917,72231012916,KMSY,KNBG",obs
70062,1/17/2025,65,39.8,54.5,54.4,72,0,0,0,,21.9,128.9,1018.5,67.9,10,2025-01-17T06:57:17,2025-01-17T17:25:33,Partly cloudy throughout the day.,"USW00012916,E9083,USW00053917,KNEW,E1090,72231553917,72231012916,KMSY,KNBG,72231612958",obs
70062,1/16/2025,64.1,46.2,53.8,53.2,63.6,0.113,100,12.5,rain,8.1,9.1,1026.3,67.9,10,2025-01-16T06:57:29,2025-01-16T17:24:41,Partly cloudy throughout the day with early morning rain.,"USW00012916,E9083,USW00053917,KNEW,E1090,72231553917,72231012916,KMSY,KNBG",obs
70062,1/15/2025,60.2,48.8,52.8,51.2,63.4,0.103,100,12.5,rain,16.1,61.1,1029,96.4,10,2025-01-15T06:57:39,2025-01-15T17:23:50,Cloudy skies throughout the day with late afternoon rain.,"USW00012916,E9083,USW00053917,KNEW,E1090,72231553917,72231012916,KMSY,KNBG",obs
70062,1/14/2025,51.2,43.1,48.3,45.5,61.9,0,0,0,,12.8,33.4,1029.4,71.6,10,2025-01-14T06:57:48,2025-01-14T17:22:58,Partly cloudy throughout the day.,"USW00012916,E9083,USW00053917,KNEW,E1090,72231553917,72231012916,KMSY,KNBG",obs
70062,1/13/2025,60.2,50,54,53.1,83.9,0.545,100,41.67,rain,18.3,4.6,1022,63.6,10,2025-01-13T06:57:54,2025-01-13T17:22:08,Partly cloudy throughout the day with rain clearing later.,"USW00012916,E9083,USW00053917,KNEW,E1090,72231553917,72231012916,KMSY,KNBG",obs
70062,1/12/2025,56,34.1,46.6,44.7,94.3,1.09,100,41.67,rain,15,66.9,1017.5,81.9,10,2025-01-12T06:58:00,2025-01-12T17:21:17,Partly cloudy throughout the day with rain.,"USW00012916,USW00053917,KNEW,E1090,72231553917,72231012916,KMSY,KNBG,72231612958",obs
70062,1/11/2025,47.9,38.9,41.4,37.6,77.5,0,0,0,rain,15,319.1,1019.3,60.5,10,2025-01-11T06:58:03,2025-01-11T17:20:27,Partly cloudy throughout the day.,"USW00012916,USW00053917,KNEW,E1090,72231553917,72231012916,KMSY,KNBG",obs
70062,1/10/2025,57.8,41,48.1,44.7,92.9,1.012,100,37.5,rain,25.2,323.6,1012.3,100,10,2025-01-10T06:58:05,2025-01-10T17:19:38,Cloudy skies throughout the day with a chance of rain throughout the day.,"USW00012916,E9083,USW00053917,KNEW,E1090,72231553917,72231012916,KMSY,KNBG",obs
70062,1/9/2025,50,38,43,36.8,65.7,0,0,0,rain,15,60.2,1023.8,78.3,10,2025-01-09T06:58:05,2025-01-09T17:18:48,Partly cloudy throughout the day.,"USW00012916,E9083,USW00053917,KNEW,E1090,72231553917,72231012916,KMSY,KNBG",obs
70062,1/8/2025,46.1,33.2,39.8,33.8,68.3,0,0,0,,13.9,347.5,1030,70.1,10,2025-01-08T06:58:04,2025-01-08T17:18:00,Partly cloudy throughout the day.,"USW00012916,E9083,KNEW,E1090,72231553917,72231012916,KMSY,KNBG",obs
70062,1/7/2025,45,34.1,39.1,33,66.3,0,0,0,,13.9,0.7,1028.4,70.4,10,2025-01-07T06:58:01,2025-01-07T17:17:12,Partly cloudy throughout the day.,"USW00012916,E9083,KNEW,E1090,72231553917,72231012916,KMSY,KNBG,72231612958",obs
70062,1/6/2025,56,36,42.1,34.6,71.8,0.396,100,12.5,rain,21.9,320.7,1020.7,62.9,10,2025-01-06T06:57:56,2025-01-06T17:16:25,Partly cloudy throughout the day with rain clearing later.,"USW00012916,E9083,USW00053917,KNEW,E1090,72231553917,72231012916,KMSY,KNBG,72231612958",obs
70062,1/5/2025,77,61.1,69,69,87.8,0.336,100,25,rain,21.9,170,1015.6,90.6,30,2025-01-05T06:57:50,2025-01-05T17:15:38,Cloudy skies throughout the day with rain.,"USW00012916,USI0000KAPS,USW00053917,KNEW,E1090,72231553917,72231012916,KMSY,KNBG,72233053865",obs
70062,1/4/2025,63,53.1,58.3,58.3,72.9,0.012,100,4.17,rain,18.3,99.3,1025.7,80.2,10,2025-01-04T06:57:42,2025-01-04T17:14:52,Partly cloudy throughout the day with late afternoon rain.,"USW00012916,USW00053917,KNEW,E1090,72231553917,72231012916,KMSY,KNBG",obs
70062,1/3/2025,66.8,55.1,60.1,60.1,70.2,0,0,0,rain,11.4,21.7,1027.1,49.6,10,2025-01-03T06:57:32,2025-01-03T17:14:07,Clearing in the afternoon.,"USW00012916,E9083,USW00053917,KNEW,E1090,72231553917,72231012916,KMSY,KNBG",obs
70062,1/2/2025,63,48.8,55.3,54.8,73,0,0,0,,12.8,72.1,1026.7,34.7,10,2025-01-02T06:57:21,2025-01-02T17:13:23,Partly cloudy throughout the day.,"USW00012916,E9083,USW00053917,KNEW,E1090,72231553917,72231012916,KMSY,KNBG",obs
70062,1/1/2025,60.2,50,55,54.8,59.8,0,0,0,,13.9,16.7,1024.2,14.8,10,2025-01-01T06:57:08,2025-01-01T17:12:40,Clear conditions throughout the day.,"USW00012916,USW00053917,KNEW,E1090,72231553917,72231012916,KMSY,KNBG",obs
70062,12/31/2024,74.9,57.8,66.1,66.1,74.3,0,0,0,rain,12.8,309.9,1013.8,37.8,10,2024-12-31T06:56:54,2024-12-31T17:11:57,Clearing in the afternoon.,"USW00012916,E9083,KNEW,E1090,72231553917,72231012916,KMSY,KNBG,72233053865,72231612958",obs
70062,12/30/2024,73.1,51.2,62,62,90.1,0,0,0,rain,13.9,171.1,1012.8,35.2,10,2024-12-30T06:56:38,2024-12-30T17:11:16,Clearing in the afternoon.,"E9083,KNEW,E1090,72231553917,72231012916,KMSY,KNBG,72231612958",obs
70062,12/29/2024,66.8,55.1,60.9,60.9,86.8,0.05,100,4.17,rain,12.8,303.8,1014.4,38.3,10,2024-12-29T06:56:20,2024-12-29T17:10:35,Becoming cloudy in the afternoon with early morning rain.,"KNEW,E1090,72231553917,72231012916,KMSY,KNBG,72231612958",obs
70062,12/28/2024,74,60.2,69.5,69.5,96.1,1.419,100,29.17,rain,21.9,148,1012.5,88.2,60,2024-12-28T06:56:01,2024-12-28T17:09:56,Partly cloudy throughout the day with rain.,"E9083,KASD,KNEW,E1090,72231553917,72231012916,KMSY,KNBG,72233053865,72231612958",obs
70062,12/27/2024,80.1,69.2,73,73.5,95.1,0.864,100,25,rain,15,179.1,1013.9,91.8,30,2024-12-27T06:55:41,2024-12-27T17:09:17,Cloudy skies throughout the day with rain in the morning and afternoon.,"E9083,KNEW,E1090,72231553917,72231012916,KMSY,KNBG,72233053865,72231612958",obs
70062,12/26/2024,72,59,64.5,64.5,96.3,0,0,0,rain,13.8,82.6,1016.5,96.4,10,2024-12-26T06:55:19,2024-12-26T17:08:40,Cloudy skies throughout the day.,"E9083,KNEW,E1090,72231553917,72231012916,KMSY,KNBG,72231612958",obs
70062,12/25/2024,64.1,58.9,61.3,61.3,95.2,0.738,100,16.67,rain,16.1,74.6,1018.2,85,10,2024-12-25T06:54:55,2024-12-25T17:08:04,Partly cloudy throughout the day with rain in the morning and afternoon.,"KNEW,E1090,72231553917,72231012916,KMSY,KNBG,72231612958",obs
70062,12/24/2024,71.1,52.1,60.3,60.3,83.9,0,0,0,,13.8,94.5,1023.4,26.7,10,2024-12-24T06:54:30,2024-12-24T17:07:29,Partly cloudy throughout the day.,"E9083,KNEW,E1090,72231553917,72231012916,KMSY,KNBG,72231612958",obs
70062,12/23/2024,64.1,41,53.7,52.9,76.7,0,0,0,,12.7,81.9,1026.6,17.8,10,2024-12-23T06:54:04,2024-12-23T17:06:55,Clear conditions throughout the day.,"E9083,KNEW,E1090,72231553917,72231012916,KMSY,KNBG,72231612958",obs
70062,12/22/2024,55.1,38.1,47.6,45.4,59.8,0,0,0,,12.7,53.5,1028.2,3.2,10,2024-12-22T06:53:37,2024-12-22T17:06:22,Clear conditions throughout the day.,"KNEW,E1090,72231553917,72231012916,KMSY,KNBG,72231612958",obs
70062,12/21/2024,53.1,39.8,46.4,42.2,59,0,0,0,,15,10.9,1027.2,14.9,10,2024-12-21T06:53:08,2024-12-21T17:05:51,Clear conditions throughout the day.,"KNEW,E1090,72231553917,72231012916,KMSY,KNBG,72231612958",obs
70062,12/20/2024,65.9,44.2,55.2,54.9,67.9,0,0,0,,18.4,330.7,1024.6,11.8,10,2024-12-20T06:52:37,2024-12-20T17:05:21,Clear conditions throughout the day.,"E9083,KNEW,E1090,72231553917,72231012916,KMSY,KNBG,72231612958",obs
70062,12/19/2024,63,52.1,57,57,84.2,0,0,0,rain,11.4,2.2,1024.1,55.5,10,2024-12-19T06:52:06,2024-12-19T17:04:53,Partly cloudy throughout the day.,"E9083,KASD,KNEW,E1090,72231553917,72231012916,KMSY,KNBG,72233053865,72231612958",obs
70062,12/18/2024,75.8,56.9,65.1,65.1,89.5,0,0,0,rain,8.1,324.9,1022.4,68.4,10,2024-12-18T06:51:33,2024-12-18T17:04:26,Partly cloudy throughout the day.,"E9083,KASD,KNEW,E1090,72231553917,72231012916,KMSY,KNBG,72233053865,KHDC,72231612958",obs
70062,12/17/2024,76.9,61.1,66.6,66.6,90.7,0,0,0,rain,9.2,66.2,1024,27.9,10,2024-12-17T06:50:59,2024-12-17T17:04:00,Partly cloudy throughout the day.,"E9083,KASD,KNEW,E1090,72231553917,72231012916,KMSY,KNBG,72233053865,72231612958",obs
70062,12/16/2024,74.9,62.1,68,68,95.6,0.022,100,8.33,rain,11.4,111,1023.2,76.2,10,2024-12-16T06:50:24,2024-12-16T17:03:36,Partly cloudy throughout the day with afternoon rain.,"E9083,KASD,KNEW,E1090,72231553917,72231012916,KMSY,KNBG,72233053865,72231612958",obs
70062,12/15/2024,76.9,56.9,67.5,67.5,89.9,0.022,100,8.33,rain,13.9,107.9,1024.6,45.1,10,2024-12-15T06:49:48,2024-12-15T17:03:13,Becoming cloudy in the afternoon with afternoon rain.,"KASD,KNEW,E1090,72231553917,72231012916,KMSY,KNBG,72233053865,72231612958",obs
70062,12/14/2024,74,57.8,65.2,65.2,84,0,0,0,rain,17.2,96.5,1026.7,63.1,10,2024-12-14T06:49:11,2024-12-14T17:02:52,Partly cloudy throughout the day.,"KASD,KNEW,E1090,72231553917,72231012916,KMSY,KNBG,72233053865,72231612958",obs
70062,12/13/2024,66.8,51.2,58.4,58.4,66.1,0,0,0,rain,18.3,81,1029.3,68.3,10,2024-12-13T06:48:33,2024-12-13T17:02:32,Partly cloudy throughout the day.,"E9083,KASD,KNEW,E1090,72231553917,72231012916,KMSY,KNBG,72233053865,72231612958",obs
70062,12/12/2024,56.9,39.9,50.2,48.9,56.7,0,0,0,,13.9,71.8,1030.9,18,10,2024-12-12T06:47:54,2024-12-12T17:02:14,Clear conditions throughout the day.,"E9083,KASD,KNEW,E1090,72231553917,72231012916,KMSY,KNBG,72233053865,72231612958",obs
70062,12/11/2024,57.8,43.1,51.8,50.3,64.4,0,0,0,rain,20.8,322.2,1025.2,25.7,10,2024-12-11T06:47:13,2024-12-11T17:01:58,Partly cloudy throughout the day.,"E9083,KASD,KNEW,E1090,72231553917,72231012916,KMSY,KNBG,72233053865,72231612958",obs
70062,12/10/2024,76.9,59,69.9,69.9,96.1,0.602,100,20.83,rain,16.1,209.7,1013,93.4,30,2024-12-10T06:46:32,2024-12-10T17:01:43,Cloudy skies throughout the day with rain.,"E9083,KASD,KNEW,E1090,72231553917,72231012916,KMSY,KNBG,72233053865,72231612958",obs
70062,12/9/2024,74.9,66.9,70.7,70.7,94.7,0.253,100,25,rain,11.4,173.3,1014.7,92.2,10,2024-12-09T06:45:50,2024-12-09T17:01:29,Cloudy skies throughout the day with a chance of rain throughout the day.,"E9083,KASD,KNEW,AV683,E1090,72231553917,72231012916,KMSY,KNBG,72233053865,72231612958",obs
70062,12/8/2024,70.1,53.1,62.9,62.9,83.7,0.022,100,8.33,rain,13.9,122.7,1021,89.3,10,2024-12-08T06:45:08,2024-12-08T17:01:18,Partly cloudy throughout the day with morning rain.,"KASD,KNEW,E1090,72231553917,72231012916,KMSY,KNBG,72233053865,72231612958",obs
70062,12/7/2024,54,45,50.7,49.1,55.7,0,0,0,,11.4,56.1,1027.8,68.2,10,2024-12-07T06:44:24,2024-12-07T17:01:08,Partly cloudy throughout the day.,"99819499999,KASD,KNEW,E1090,72231553917,72231012916,KMSY,KNBG,72233053865,72231612958",obs
70062,12/6/2024,52.1,39.8,46.4,42.2,51.6,0,0,0,,17.3,16.7,1028.4,41.8,10,2024-12-06T06:43:40,2024-12-06T17:00:59,Becoming cloudy in the afternoon.,"E9083,KASD,KNEW,E1090,72231553917,72231012916,KMSY,KNBG,72233053865,72231612958",obs
70062,12/5/2024,69.2,49.9,60.6,60.4,87.8,1.268,100,33.33,rain,18.3,36.8,1022,85,10,2024-12-05T06:42:55,2024-12-05T17:00:53,Partly cloudy throughout the day with a chance of rain throughout the day.,"E9083,KASD,KNEW,E1090,72231553917,72231012916,KMSY,KNBG,72233053865,72231612958",obs
70062,12/4/2024,67.9,42.2,56.9,56.4,76.1,0.011,100,4.17,rain,10.3,120.8,1026.7,80.7,10,2024-12-04T06:42:09,2024-12-04T17:00:48,Partly cloudy throughout the day with late afternoon rain.,"E9083,KNEW,E1090,72231553917,72231012916,KMSY,KNBG,72233053865,72231612958",obs
70062,12/3/2024,57.8,42.2,50.6,50.2,74.4,0,0,0,,13.9,44.2,1031.9,22.2,10,2024-12-03T06:41:23,2024-12-03T17:00:44,Partly cloudy throughout the day.,"E9083,KASD,KNEW,E1090,72231553917,72231012916,KMSY,KNBG,72233053865,72231612958",obs
70062,12/2/2024,61.1,46.2,53.4,53.2,63.6,0,0,0,,15,37.7,1028.8,39.1,10,2024-12-02T06:40:36,2024-12-02T17:00:43,Partly cloudy throughout the day.,"99819499999,E9083,KASD,KNEW,E1090,72231553917,72231012916,KMSY,KNBG,72233053865,72231612958",obs
70062,12/1/2024,64.1,42.2,53.1,53.1,67.3,0,0,0,,9.2,22.1,1025.1,21.1,10,2024-12-01T06:39:49,2024-12-01T17:00:43,Partly cloudy throughout the day.,"E9083,KASD,KNEW,E1090,72231553917,72231012916,KMSY,KNBG,72233053865,72231612958",obs
70062,11/30/2024,57.8,44.1,50.1,47.6,54.9,0,0,0,,13.9,55.8,1026.2,20.1,10,2024-11-30T06:39:01,2024-11-30T17:00:44,Partly cloudy throughout the day.,"KASD,KNEW,E1090,72231553917,72231012916,KMSY,KNBG,72233053865,72231612958",obs
70062,11/29/2024,57,48.8,53.3,53,57.2,0.012,100,4.17,rain,16.1,13.2,1024,62.8,10,2024-11-29T06:38:13,2024-11-29T17:00:48,Clearing in the afternoon with early morning rain.,"E9083,KASD,KNEW,E1090,72231553917,72231012916,KMSY,KNBG,72233053865,72231612958",obs
70062,11/28/2024,73.1,56,66.5,66.5,81.3,0,0,0,rain,15,346.1,1015.3,86.9,10,2024-11-28T06:37:25,2024-11-28T17:00:53,Partly cloudy throughout the day.,"KASD,KNEW,E1090,72231553917,72231012916,KMSY,KNBG,72233053865,72231612958",obs
70062,11/27/2024,76.9,55.2,67.6,67.6,93.2,0.012,100,4.17,rain,12.8,174.5,1014.7,77,30,2024-11-27T06:36:36,2024-11-27T17:01:00,Partly cloudy throughout the day with late afternoon rain.,"99819499999,E9083,KASD,KNEW,E1090,72231553917,72231012916,KMSY,KNBG,72233053865,72231612958",obs
70062,11/26/2024,69.2,61.1,66.6,66.6,94.7,0.07,100,8.33,rain,11.4,310.1,1020.2,90.9,10,2024-11-26T06:35:46,2024-11-26T17:01:08,Cloudy skies throughout the day with early morning rain.,"E9083,KNEW,E1090,72231553917,72231012916,KMSY,KNBG,72231612958",obs
70062,11/25/2024,80.1,57.9,69.5,69.6,82.1,0,0,0,rain,16.1,173.7,1020,38.9,10,2024-11-25T06:34:57,2024-11-25T17:01:19,Partly cloudy throughout the day.,"E9083,KASD,KNEW,E1090,72231553917,72231012916,KMSY,KNBG,72233053865,72231612958",obs
70062,11/24/2024,74,48.9,62.6,62.5,83.3,0,0,0,,10.3,145.6,1019.7,21.1,10,2024-11-24T06:34:07,2024-11-24T17:01:31,Partly cloudy throughout the day.,"KASD,KNEW,E1090,72231553917,72231012916,KMSY,KNBG,72233053865,72231612958",obs
70062,11/23/2024,65.9,46.2,56.8,56.6,70.3,0,0,0,rain,8.1,57.7,1021.3,8.5,10,2024-11-23T06:33:17,2024-11-23T17:01:44,Clear conditions throughout the day.,"KNEW,E1090,72231553917,72231012916,KMSY,KNBG,72231612958",obs
70062,11/22/2024,64.1,48.9,56.1,56,58,0,0,0,,11.4,312.9,1020.8,5.3,10,2024-11-22T06:32:27,2024-11-22T17:02:00,Clear conditions throughout the day.,"E9083,KASD,KNEW,E1090,72231553917,72231012916,KMSY,KNBG,72233053865,72231612958",obs
70062,11/21/2024,66.8,53.2,58.9,58.9,41.5,0,0,0,,16.1,317.2,1022,0,10,2024-11-21T06:31:37,2024-11-21T17:02:17,Clear conditions throughout the day.,"E9083,KASD,KNEW,72231553917,E1090,72231012916,KMSY,KNBG,72233053865,72231612958",obs
70062,11/20/2024,72,58.9,66.4,66.4,60.1,0,0,0,,20.8,328.8,1017.7,12.8,10,2024-11-20T06:30:47,2024-11-20T17:02:36,Clear conditions throughout the day.,"E9083,KNEW,72231553917,E1090,72231012916,KMSY,KNBG,72231612958",obs
70062,11/19/2024,80.1,68,74.5,74.9,86.1,1.876,100,37.5,rain,19.6,262.4,1007.3,80.2,10,2024-11-19T06:29:57,2024-11-19T17:02:56,Partly cloudy throughout the day with rain clearing later.,"E9083,KNEW,E1090,72231553917,72231012916,KMSY,KNBG,72231612958",obs
70062,11/18/2024,83,71.1,76.1,76.6,81.3,0.084,100,20.83,rain,19.6,135.2,1010.7,78,10,2024-11-18T06:29:07,2024-11-18T17:03:18,Partly cloudy throughout the day with late afternoon rain.,"E9083,KASD,KNEW,E1090,72231553917,72231012916,KMSY,KNBG,72233053865,72231612958",obs
70062,11/17/2024,81,66,73.4,73.6,74,0,0,0,,13.9,109.5,1016.3,70.3,10,2024-11-17T06:28:17,2024-11-17T17:03:42,Partly cloudy throughout the day.,"KASD,KNEW,E1090,72231553917,72231012916,KMSY,KNBG,72233053865,72231612958",obs
70062,11/16/2024,76.9,57.9,67.7,67.7,79.3,0,0,0,,11.4,82,1016.4,39.3,10,2024-11-16T06:27:26,2024-11-16T17:04:07,Becoming cloudy in the afternoon.,"E9083,KASD,KNEW,E1090,72231553917,72231012916,KMSY,KNBG,72233053865,72231612958",obs
70062,11/15/2024,72,61.1,65.7,65.7,64.8,0,0,0,,15,33.9,1017.3,6.4,10,2024-11-15T06:26:36,2024-11-15T17:04:34,Clear conditions throughout the day.,"E9083,KASD,KNEW,E1090,72231553917,72231012916,KMSY,KNBG,72233053865,72231612958",obs
70062,11/14/2024,74,65.9,70.6,70.6,69.6,0,0,0,rain,11.5,332.3,1016.2,32.6,10,2024-11-14T06:25:46,2024-11-14T17:05:02,Clearing in the afternoon.,"E9083,KASD,KNEW,72231553917,E1090,72231012916,KMSY,KNBG,72233053865,72231612958",obs
70062,11/13/2024,80.1,74,76.2,76.4,93.1,0.099,100,25,rain,21.8,132.5,1013.2,91,30,2024-11-13T06:24:57,2024-11-13T17:05:32,Cloudy skies throughout the day with rain in the morning and afternoon.,"E9083,KNEW,E1090,72231553917,72231012916,KMSY,KNBG,72231612958",obs
70062,11/12/2024,74.9,68,71.4,71.4,93.3,0.47,100,58.33,rain,17.2,36.2,1013,99.5,10,2024-11-12T06:24:07,2024-11-12T17:06:04,Cloudy skies throughout the day with rain.,"E9083,KNEW,E1090,72231553917,72231012916,KMSY,KNBG,72231612958",obs
70062,11/11/2024,83,72,76.5,77.3,82.1,0.012,100,4.17,rain,15,5.1,1013.2,53.2,10,2024-11-11T06:23:18,2024-11-11T17:06:37,Partly cloudy throughout the day with early morning rain.,"E9083,KNEW,E1090,72231553917,72231012916,KMSY,KNBG,72231612958",obs
70062,11/10/2024,78.2,73.2,76.1,76.1,90,0.173,100,16.67,rain,13.9,77.9,1014,94.2,10,2024-11-10T06:22:29,2024-11-10T17:07:11,Cloudy skies throughout the day with rain in the morning and afternoon.,"KNEW,E1090,72231553917,72231012916,KMSY,KNBG,72231612958",obs
